Start Time,End Time,EN,ES,Highlight,Comments,Speaker
00:29:29:22,00:29:33:03,It is said that it is to ward off diseases,se comenta que es para ahuyentar las enfermedades,,,eliana
00:29:33:19,00:29:38:22,"and to keep us healthy,
so it's like she absorbs it and also","y para mantenernos sanos,
entonces es como que ella lo absorbe y también",,,eliana
00:29:39:15,00:29:43:05,"this is a little piece
babies are placed when they are","este es un pedacito,
se les coloca a los bebés cuando están",,,eliana
00:29:43:11,00:29:46:09,when they are months old,cuando están de meses.,,,eliana
00:29:46:09,00:29:49:23,It was also well known and longed for,También fue muy conocida y muy anhelada,,,eliana
00:29:49:23,00:29:52:20,"at the time, in the time of pandemic,","en la época, en el tiempo de pandemia,",,,eliana
00:29:53:09,00:29:56:14,"It was longed for here, by us,","fue muy anhelada por acá, por nosotros,",,,eliana
00:29:57:18,00:30:00:21,"The, well, those of us who know the properties","Los, bueno, los que conocemos las propiedades",,,eliana
00:30:00:21,00:30:05:03,"or what is done with this bija, then","o lo que es lo que se hace con esta bija, entonces",,,eliana
00:30:06:08,00:30:07:24,there it was like,ahí se ponía como,,,eliana
00:30:07:24,00:30:11:14,"incense style and as well as to move away,","estilo de sahumerio y así como que alejar,",,,eliana
00:30:12:14,00:30:15:19,remove or purify the environment to,alejar o purificar el ambiente para,,,eliana
00:30:15:23,00:30:21:09,"so that there would be no disease,
so that COVID did not reach our homes.","para que no hubiera enfermedad,
para que no llegara el COVID a nuestros hogares.",,,eliana
00:30:21:09,00:30:24:01,And I think it worked.,Y creo que funcionó.,,,eliana
00:30:24:01,00:30:25:20,"Here we are, healthy.",Aquí estamos sanos.,,,eliana
00:30:25:20,00:30:29:21,"And yes, this is a style","Y pues sí, esta es un estilo",,,eliana
00:30:30:21,00:30:32:21,of wood,de madera,,,eliana
00:30:32:21,00:30:35:04,"that comes from a plant, from a medicinal plant,","que viene de una planta, de una planta medicinal,",,,eliana
00:30:36:20,00:30:42:09,"So yes, and they burn it and it smells good, it smells good.","entonces sí, y la queman y huele rico, huele rico.",,,eliana
00:30:42:15,00:30:44:06,It has a good smell,Tiene buen olor,,,eliana
00:30:44:06,00:30:46:19,So that wood specifically?,¿Entonces esa madera específicamente?,,,eliana
00:30:47:10,00:30:50:04,"Yeah. Is.
Not just any wood.","Si. Es.
No cualquier madera.",,,eliana
00:30:50:04,00:30:53:06,"No, no, no, this one comes from a tree.","No, no, no, esta viene de un árbol.",,,eliana
00:30:53:06,00:30:55:14,"I don't know the name of the tree, but,","No me sé el nombre del árbol, pero,",,,eliana
00:30:55:14,00:30:58:15,But it is a type of wood that smells rich.,Pero es un tipo de madera que huele a rico.,,,eliana
