Start Time,End Time,EN,ES,Highlight,Comments
00:31:22:00,00:31:24:21,"This is from the internet, it can be downloaded on the web.","Esto se consigue en internet, en la web se puede descargar.",,
00:31:24:24,00:31:28:11,I think maybe if we read this. Yes Yes.,Yo creo que tal vez si leímos esto. Sí. Sí.,,
00:31:28:12,00:31:30:06,"So this,","Entonces esto,",,
00:31:30:07,00:31:32:14,"This, for example, is the hill of Guososopo","esto por ejemplo, es el cerro de Guososopo",,
00:31:33:07,00:31:34:02,Guososopo,Guososopo,,
00:31:34:02,00:31:38:24,"It means our lungs,
because this is as if you","quiere decir nuestros pulmones,
porque esto es como si tú",,
00:31:40:15,00:31:43:01,"you would open a person's lungs, alive,","abrieras los pulmones de una persona, vivos,",,
00:31:43:20,00:31:45:23,and they would look like this pink.,y se verían así rosados.,,
00:31:46:15,00:31:51:26,"A Wayuú who in mythical times
He traveled from the Sierra Nevada,","Un wayuú que en tiempos míticos
viajó de la Sierra Nevada,",,
00:31:51:27,00:31:53:07,He traveled all this,viajo todo esto,,
00:31:53:08,00:31:54:12,and died of thirst,y se murió de sed,,
00:31:54:12,00:31:59:05,"in the desert,
Only his lungs were left, turned into hills.","en el desierto,
solo quedaron sus pulmones convertidos en cerros.",,
00:31:59:21,00:32:04:24,"So this hill is a story and it is a hill,
then like this","Entonces este cerro es una historia y es un cerro,
entonces así",,
00:32:05:02,00:32:07:22,"each one of those hills has a meaning,","cada uno de esas colinas tiene un sentido,",,
00:32:08:09,00:32:11:28,"has a story to tell,
so that's why we did it","tiene una narración que contar,
entonces por eso lo hicimos",,
00:32:11:29,00:32:15:25,"So, we traveled for three days stopping in each place,","así, viajamos por tres días parando en cada lugar,",,
00:32:15:26,00:32:19:13,"I told the mythical stories,
That is the story of this book.","yo contaba las historias míticas,
esa es la historia de este libro.",,
00:32:19:25,00:32:22:03,"Yes, yes.","Sí, sí.",,
00:32:22:04,00:32:23:26,"And in there, like this","Y ahí adentro, como esto está",,
00:32:24:29,00:32:27:06,they are inside there are,"ahí adentro están,",,
00:32:27:08,00:32:31:15,"So I would focus on that, if you want,","entonces yo les enfocaría, si quieren en eso,",,
00:32:32:28,00:32:35:06,work the territory very visually.,trabajar muy visualmente el territorio.,,
00:32:35:07,00:32:36:23,"Sometimes they focus on homes and yes,",A veces se centran en las viviendas y si,,
00:32:36:24,00:32:41:03,"homes are important,
but there are multiple, thousands of homes.","las viviendas son importantes,
pero hay múltiples, miles de viviendas.",,
00:32:41:15,00:32:46:01,"Instead, these places,
talk to those background places,","En cambio, estos lugares,
hablar con esos lugares de trasfondo,",,
00:32:46:02,00:32:46:29,the sea too,el mar también,,
00:32:49:02,00:32:51:15,or a territorial root.,o una raíz territorial.,,
00:32:51:26,00:32:54:24,"There is a stone, the stone of Aalasü
that is up there,","Hay una piedra, la piedra de Aras
que está allá arriba,",,
00:32:56:08,00:32:57:22,"that stone is mythological,","esa piedra es mitológica,",,
00:32:57:22,00:32:59:23,"there are all the family clan emblems,","están todos los emblemas clanines,",,
00:33:00:24,00:33:02:25,That stone tells us a lot.,esa piedra nos dice mucho.,,
00:33:02:26,00:33:06:03,Let's see if I have it here.,Vamos a ver si la tengo aquí.,,
00:33:06:04,00:33:09:21,If I have it.,Si la tengo.,,
00:33:09:22,00:33:13:29,"It seems that no, I don't have it here,","Parece que no, que no la tengo aquí,",,
00:33:14:20,00:33:17:07,but I'm going to put it,pero ya la voy a poner,,
00:33:17:13,00:33:21:19,Ancient newcomers. Is…,antiguos recién llegados. Es…,,
00:33:27:26,00:33:29:13,so that's my idea.,entonces esa es mi idea.,,
00:33:29:13,00:33:30:05,"Now,","Ahora,",,
00:33:30:26,00:33:33:05,There are trees that tell us a lot.,hay árboles que nos dicen mucho.,,
00:33:33:06,00:33:33:17,Also.,También.,,
00:33:33:18,00:33:38:01,"Because they are stories about trees
and a beautiful, fundamental, very common tree","Porque son historias de árboles
y un árbol bello, fundamental, muy común",,
00:33:38:02,00:33:40:27,"here is Trujillo, it's called Aipia.","aquí es el Trupillo, se llama Aipia.",,
00:33:41:16,00:33:44:06,His task was to heal,Su tarea era curar,,
00:33:44:07,00:33:46:20,"the fractures of people when they were human,","las fracturas de la gente cuando era humano,",,
00:33:47:14,00:33:51:10,"before it became a
tree, he dedicated himself to healing","antes que se convirtiera en un
árbol, él se dedicaba a curar",,
00:33:52:10,00:33:56:08,"and today if you break your leg,
an arm,","y hoy en día si tú te fracturas una pierna,
un brazo,",,
00:33:56:26,00:34:01:16,"They splint it for you with wood from Trupillo,
because that was his job","te lo entablillan con madera de Trupillo,
porque ese era su oficio",,
00:34:02:16,00:34:07:08,and it is a tree that the Wayuú leave near their homes.,y es un árbol que los wayuú dejan cerca a sus casas.,,
00:34:07:19,00:34:11:08,"They generally cut down everything
to have a view of who is arriving.","Generalmente talan todo
para tener una vista de quien llega.",,
00:34:11:27,00:34:12:15,So.,Entonces.,,
00:34:12:15,00:34:14:26,But the tree they leave is Trupillo,Pero el árbol que dejan es el Trujillo,,
00:34:15:26,00:34:19:12,"His name is Aipia and he is very wise, he is peaceful.","Aipia se llama y es muy sabio, es pacífico.",,
00:34:19:13,00:34:23:06,It has many advantages.,Tiene muchas ventajas.,,
00:34:23:07,00:34:24:20,"Gives food,","Da comida,",,
00:34:25:00,00:34:28:26,"Before it gave nutritious food,
proteins, vegetables.","antes daba un alimento nutritivo,
proteínas, vegetales.",,
00:34:29:08,00:34:31:11,Nowadays the Wayuú have somewhat lost their consumption of,Hoy en día  los wayuú han perdido un poco el consumo de,,
00:34:31:12,00:34:33:09,that was,eso que era,,
00:34:33:10,00:34:35:13,so important for Wayuú nutrition.,tan importante para la nutrición wayú.,,
00:34:35:27,00:34:38:28,"So the trees tell us things,","Entonces los árboles nos dicen cosas,",,
00:34:39:13,00:34:44:13,"So if you focus, you are going to film, look.
what do you have back there,","entonces si se enfocan, se van a filmar, fíjate
bien qué tienes ahí detrás,",,
00:34:44:24,00:34:49:08,"because surely there is a story in the plant,
It is more than a backdrop,","porque seguramente hay una historia en la planta,
hay más que un telón de fondo,",,
00:34:49:26,00:34:51:17,It is a story.,es una historia.,,
00:34:51:18,00:34:54:01,"Yes, so that is what I was going to recommend,","Si entonces eso es lo que te  iba a recomendar,",,
00:34:55:05,00:34:58:04,"That would be my advice. The rest,","Sería mi consejo. Lo demás,",,
00:34:58:05,00:35:01:11,"Well, the Earth is an excellent starting point,","bueno, la tierra es un excelente punto de partida,",,
00:35:01:14,00:35:03:26,perhaps the deepest starting point,quiza el más profundo punto de partida,,
00:35:04:25,00:35:06:27,It is the issue of territory.,es el tema del territorio.,,
00:35:06:28,00:35:09:12,"I would have coastal areas,","Yo tendría zonas costeras,",,
00:35:09:13,00:35:13:14,"inland areas, of shepherds, the Wayuú economy","zonas de adentro, de pastores,  la economía wayú",,
00:35:13:25,00:35:16:01,It tells us about a relationship with the land.,nos habla de una relación con la tierra.,,
00:35:17:14,00:35:20:26,"Wayuú agriculture is beautiful, and I talked about it
that night.","La agricultura wayú es hermosísimo y yo lo hablé
esa noche.",,
00:35:20:27,00:35:23:03,What's the point of all this?,¿Qué sentido tiene todo esto?,,
00:35:23:12,00:35:29:10,"Grazing, fishing, weaving also speak to us,
because the fabric","El pastoreo, la pesca,  el tejido también nos habla,
porque el tejido",,
00:35:29:23,00:35:33:03,"look at this,","mira esto,",,
00:35:33:04,00:35:37:07,"This is a Wayuú fabric,
but this is a fabric of the sea,","esto es un tejido wayuú,
pero este es un tejido del mar,",,
00:35:38:04,00:35:43:18,"This is called like the eye of the fish,
like the eye of the fish.","este se llama como el ojo del pez,
como el ojo del pez.",,
00:35:44:03,00:35:47:09,"So I'm going to show it to you here,","Entonces ya te lo voy a mostrar aquí,",,
00:35:47:10,00:35:48:15,"rather,","más bien,",,
00:35:49:14,00:35:53:25,"These are Wayuú graphics, canoe graphics.","estos son grafismos wayuú, grafismos de canoas.",,
00:35:54:04,00:35:55:18,"So,","Entonces,",,
00:35:55:19,00:35:58:02,when filming a documentary,al filmar un documental,,
00:35:58:03,00:35:59:29,"I would say that,","yo diría que,",,
00:36:01:17,00:36:02:17,"look at this,","mira esto,",,
00:36:02:24,00:36:07:26,"They are the Wayuú
hanging fish like leaves","son los wayuú
colgando los peces como hojas",,
00:36:08:05,00:36:10:05,"So,","Así es que,",,
00:36:10:06,00:36:13:29,"What I mean is that when we see a backpack,","Lo que yo
quiero decir es que cuando vemos una mochila,",,
00:36:14:15,00:36:17:19,"When we see a Wayuú object, it is talking to us,","cuando vemos un objeto wayuú, él nos está hablando,",,
00:36:18:12,00:36:21:06,but sometimes we go over it,pero a veces pasamos por encima de él,,
00:36:21:07,00:36:24:00,like shapes that have no message that’s just a fabric.,como formas que no tienen un mensaje ni un tejido.,,
00:36:24:15,00:36:26:28,"This means like the eye of the fish,","Esto quiere decir como el ojo del pez,",,
00:36:27:23,00:36:31:02,like the eye of the fish.,como el ojo del pez.,,
00:36:31:03,00:36:32:15,"So,","Así que,",,
00:36:32:18,00:36:34:27,I would also suggest,que también sugeriría,,
00:36:36:16,00:36:38:13,To do a lot in,hacer mucho en los,,
00:36:38:13,00:36:42:00,"in the graphics, in the designs, in the objects.","en los grafismos, en los diseños, en los objetos.",,
00:36:42:01,00:36:44:19,"The artifacts have a meaning and they are
Talking to us","Los artefactos tienen un sentido y nos están
hablando.",,
00:36:44:20,00:36:47:17,"It’s just that we don't know how to read, we don't know how to read,","Solo que como no sabemos leer, no sabemos leer,",,
00:36:47:26,00:36:51:08,"we would be illiterate in these graphics,
as if we saw","seríamos analfabetos en estos grafismos,
como si viéramos",,
00:36:52:17,00:36:53:24,a sign written in,un letrero escrito en,,
00:36:53:24,00:36:57:07,"Russian or Hindi or Chinese, one could not read it,","Ruso o en Hindú o en chino, uno no lo podría leer,",,
00:36:57:08,00:36:59:00,"Well, that's what happens with Wayuú graphics.","Bueno, así pasa con los grafismos wayuú.",,
00:36:59:00,00:37:01:18,Yes.,Sí.,,
00:37:02:12,00:37:05:24,Look at this for example.,Mira esto por ejemplo.,,
00:37:05:25,00:37:07:18,"That's nice.
From Palabrero.","Eso esta lindo.
De Palabrero.",,
00:37:08:26,00:37:12:00,"Yes, Oops, yes.","Sí, Uy, sí.",,
00:37:12:27,00:37:15:00,This is the first bird,Este es el primer pájaro,,
00:37:15:13,00:37:18:16,who worked as a palabrero,que ejerció el oficio de palabrero,,
00:37:18:17,00:37:19:25,in mythological times.,en tiempos mitológicos.,,
00:37:19:25,00:37:23:23,"He created the Wayuú laws, the norms
and then he retired.","Él creó las leyes wayú, las normas
y luego se retiró.",,
00:37:24:09,00:37:28:18,"But the knowledge they have of the
Wayuú laws belong to a bird.","Pero el conocimiento que tienen de las
leyes lo wayú es de un pájaro.",,
00:37:29:06,00:37:31:07,Utta is called Utta,Utta se llama Utta,,
00:37:31:22,00:37:33:12,and can you still see it?,¿y todavía lo pueden ver?,,
00:37:33:13,00:37:36:16,"Yes, the bird exists, of course, I have photographed it.","Si el pájaro existe, claro, yo lo he fotografiado.",,
00:37:36:17,00:37:38:17,Of course.,Claro que sí.,,
00:37:38:18,00:37:40:20,"It's a big bird, it's tame.","Es un pájaro grande, es manso.",,
00:37:40:21,00:37:43:19,"It's not a bird that gets scared, but no, no, no,","No es un pájaro que se asusta, si no, no, no,",,
00:37:44:00,00:37:47:06,I approached him very close.,yo me le acerqué muy cerca.,,
00:37:47:07,00:37:48:27,"He has a bird necklace, here,","Tiene un collar pájaro,aquí,",,
00:37:48:28,00:37:51:01,"a black, yellow and black necklace.","un collar negro, amarillo con negro.",,
00:37:51:02,00:37:52:18,"They awarded that necklace,","Ese collar se lo premiaron,",,
00:37:52:18,00:37:57:01,"It was given by Mareiwa,
one of the Wayú figures, for having given the laws","se lo dio Mareiwa
,
una de las figuras wayú, por haber dado las leyes",,
00:37:57:06,00:37:59:11,he rewarded him.,lo premió.,,
00:38:09:09,00:38:12:22,and have you seen many signs and symbols like that?,¿y ha visto muchas señales y símbolos así?,,
00:38:12:24,00:38:15:20,"Well, this is my clan.
Your clan?
Mine Yes, yes, yes.","Bueno, este es mi clan.
¿Su clan?
El mío Sí, sí, sí.",,
00:38:16:23,00:38:17:19,That's why it's there.,Por eso está ahí.,,
00:38:17:19,00:38:19:11,That's why I,Por eso te,,
00:38:20:07,00:38:21:14,"said,","decia,",,
00:38:21:15,00:38:24:15,"I was saying that,","te decía que no,",,
00:38:24:20,00:38:28:03,"that,","que,",,
00:38:28:04,00:38:35:13,"that the graphics speak to us,
but we passed over it.","que los gráficos nos hablan,
pero pasamos por encima de él.",,
00:38:59:03,00:39:01:03,"So,","Entonces,",,
00:39:04:01,00:39:07:13,"a girl said that night,","una niña dijo esa noche,",,
00:39:07:14,00:39:09:11,"a girl said,","una niña dijo,",,
00:39:09:12,00:39:12:23,"Out of all the musical instruments that,","de todos los instrumentos musicales que esto,",,
00:39:12:25,00:39:13:22,"This one is,","este es,",,
00:39:13:23,00:39:16:28,But they haven't removed this one's beak.,Pero a este no le han quitado el pico.,,
00:39:16:29,00:39:18:17,"For this to be a musical instrument,","Para que esto sea un instrumento musical,",,
00:39:18:17,00:39:20:17,"well, it has to be perfect here, closed","bueno, tiene que estar perfecto aquí cerrado",,
00:39:21:08,00:39:23:15,and here one takes off his beak,y aquí se quita el pico,,
00:39:23:27,00:39:25:19,"and it is played like this,","y se toca así,",,
00:39:25:20,00:39:28:08,but only from the Wayuú fishermen.,pero sólo de los pescadores wayú.,,
00:39:28:09,00:39:30:10,"Yes, to communicate.","Sí, para comunicarse.",,
00:39:30:18,00:39:33:18,To communicate yes.,Para comunicarse sí.,,
00:39:34:12,00:39:37:15,That's interesting because I don't know if you saw it but in,"Eso es interesante, porque no se si vio pero en",,
00:39:37:29,00:39:40:24,"Peru there is an indigenous town, it is called Pituquisca","Perú hay un pueblo indígena, se llama Pituquisca",,
00:39:40:25,00:39:43:28,"of the Quechua up the mountain, in the Andes.","de los quechua arriba de la montaña, en los Andes.",,
00:39:43:29,00:39:44:29,Have.,Tienen.,,
00:39:45:00,00:39:48:04,"And they have, of course, and they bartered with those on the coast.","Y tienen, claro, y se hicieron trueques con los de la costa.",,
00:39:49:06,00:39:50:09,"The Mayans too,","Los mayas también,",,
00:39:50:10,00:39:50:28,From the Mayans too,De los mayas también,,
00:39:50:28,00:39:51:22,"a lot, the","mucho, los",,
00:39:51:22,00:39:54:15,"Mayans in Mexico and yes,","Mayas en México y sí,",,
00:39:54:28,00:39:58:05,In Yucatán that entire area touches those snails.,en Yucatán toda esa zona tocan esos caracoles.,,
00:39:58:06,00:40:01:24,"It must have been a very broad horizon.
among the peoples of America.","Debió ser un horizonte muy amplio
entre los pueblos de América.",,
00:40:01:25,00:40:03:28,"The snail
Yes, that's right.","El caracol
Sí, eso si.",,
00:40:04:08,00:40:08:16,"Because I saw a drum and I was in Canadá
about 15 days ago","Porque vi un tambor y yo estuve en Canadá
hace como 15 días",,
00:40:09:10,00:40:12:17,"and I had touring up to Winnipeg
throughout that area.","y tuve recorriendo arriba de Winnipeg
por toda esa zona.",,
00:40:13:02,00:40:13:18,Yeah,Sí,,
00:40:15:07,00:40:17:01,I was in Canadá,"estaba en Canadá,",,
00:40:17:02,00:40:20:02,"I was way up north,
The big rapids and all that,","estaba bien al norte,
los grandes rápidos y todo eso,",,
00:40:20:16,00:40:23:23,touring indigenous towns and talking,recorriendo pueblos indígenas y hablando,,
00:40:23:24,00:40:26:17,And we had rituals and everything.,Y tuvimos rituales y todo.,,
00:40:26:18,00:40:29:28,"And I saw drums, indigenous drums","Y vi tambores, tambores indígenas",,
00:40:30:15,00:40:32:04,in Canada.,en Canadá.,,
00:40:32:05,00:40:35:12,"Similar to the ones here?
Similar, similar, but with only one instrument.","¿Parecidos a los de aquí?
Parecido, parecido, pero con un solo instrumento.",,
00:40:35:13,00:40:39:04,"It is played with only one, not two like the Wayuú but one.","Se toca con uno solo, no dos como el wayú sino uno.",,
00:40:39:14,00:40:43:04,"And I saw drums of one layer and others like that, and other made","Y vi tambores de una capa y otros así, y otros hechos",,
00:40:43:05,00:40:47:14,"with deer stomach
or bison which are water drums.","con estómago de venado
o de bisonte que son tambores de agua.",,
00:40:48:05,00:40:49:29,"Yes, very interesting.","Sí, muy interesantes.",,
00:40:49:29,00:40:52:13,And I was in several ceremonies and everything there in Canada.,Y estuve en varias ceremonias y todo allá en Canada.,,
00:40:53:06,00:40:56:08,So there are a series of instruments,Entonces hay una serie de instrumentos,,
00:40:56:27,00:41:01:14,"very, very common,
those found, for example,","muy, muy comunes,
esos que se encuentran, por ejemplo,",,
00:41:03:28,00:41:07:09,"The Wayuú have these, but they have them as maracas.","Los wayú tienen estos, pero lo tienen como maracas.",,
00:41:07:19,00:41:08:03,They got them,Lo tienen,,
00:41:08:04,00:41:08:17,as,como,,
00:41:08:17,00:41:12:14,"a musical instrument,
They have this with bison horn.","un instrumento musical,
esto lo tienen con cuerno de bisonte.",,
00:41:15:06,00:41:16:20,"And this is,","Y esto es,",,
00:41:16:21,00:41:19:18,"It is used for the shamanic ceremony,","se utiliza para la ceremonia chamánica,",,
00:41:20:08,00:41:24:24,"to go up, find the spirits up there, to heal.","para subir, encontrar los espiritus allá arriba, para curar.",,
00:41:25:09,00:41:30:17,"So this sound allows it to rise
and the tobacco that the woman chews","Entonces este sonido permite que ascienda
y el tabaco que masca la",,
00:41:30:18,00:41:31:26,"shaman woman,","mujer chamán,",,
00:41:31:27,00:41:36:24,"It goes up and there it finds in the elevation
the spirit that will help her heal.","va subiendo y allá encuentra en la elevación
el espíritu que la va a ayudar a curar.",,
00:41:37:02,00:41:41:11,"And then the Canadians have it too,
but they do it with their animals that they have next to them.","Y entonces los canadiences también lo tienen,
pero lo hacen con sus animales que tienen al lado.",,
00:41:41:13,00:41:44:01,Yes of the bison.,Si del bisonte.,,
00:41:44:15,00:41:46:05,"Do you have seeds in there?
Seeds.","¿Semilla tiene ahí adentro?
Semillas.",,
00:41:49:25,00:41:54:08,"That's what you were telling me about the clan symbol,","Es eso que me estaba contando del símbolo del clan,",,
00:41:54:20,00:41:58:26,"I wanted to know a little more about you,
that is, you are from","quería saber un poco más de usted,
o sea usted es de",,
00:41:59:18,00:42:03:12,"My area is Carrizal, up there, Carrizal.","La zona mia es del Carrizal, allá arriba, Carrizal.",,
00:42:03:25,00:42:05:27,"Carrizal, yes, I'm going to show you,","Carrizal,sí, ya te voy a mostrar,",,
00:42:06:24,00:42:10:06,"Carrizal is,","Carrizal es,",,
00:42:10:07,00:42:13:20,the land of my ancestors.,la tierra de mis ancestros.,,
00:42:14:10,00:42:16:20,"But that's close to the beach
by Cabo de la Vela.","Pero eso está cerca a la playa
por el Cabo de la Vela.",,
00:42:17:10,00:42:18:15,If there is,Si allá hay,,
00:42:18:16,00:42:20:19,"the cemetery,","el cementerio,",,
00:42:20:20,00:42:28:01,That's why I tell you it's so important.,por eso te digo que es tan importante.,,
00:43:10:14,00:43:14:19,"This is located here, perhaps
you saw it here.","Este se encuentra aquí,  quizás
ustedes lo vieron aquí.",,
00:43:17:16,00:43:21:02,"Look at the hills, the hill, the Cabo de la Vela,
I tell you that it is a story,","Mira los cerros, el cerro, el Cabo de la Vela,
que yo les digo que es una historia,",,
00:43:21:04,00:43:24:06,"Kamachi married a windy woman,","Kamachi se casó con una mujer viento,",,
00:43:24:07,00:43:27:03,"He manages the things of the sea.
This is the older brother, he is in the Macuira,","él maneja las cosas del mar.
Este es el hermano mayor, está en la Macuira,",,
00:43:27:04,00:43:29:02,Itojolu,Itojolu,,
00:43:29:19,00:43:31:21,"This is the brother, another of the younger brothers.","este es el hermano, otro de los hermanos menores.",,
00:43:31:22,00:43:34:09,"It is towards the Gulf with Venezuela through Uribia,","Está hacia el Golfo con Venezuela por Uribia,",,
00:43:35:16,00:43:38:07,"Epitsü, Cerro de la Teta.","xxxx, cerro de la Teta.",,
00:43:38:08,00:43:42:01,"Each being is a story,
This is a relative of mine, relatives","Cada ser es una historia,
este es un pariente mío, familiares",,
00:43:42:02,00:43:43:26,"mine, is on a map of the hills.","mios, esté en mapa de los cerros.",,
00:43:43:27,00:43:48:07,"Look in La Guajira
how the hills form a triangle, they are tutelary,","Mira en La Guajira
cómo los cerros forman un triángulo, son tutelares,",,
00:43:48:12,00:43:51:17,In the territory you have to understand their position.,en el territorio hay que entender su posición.,,
00:43:52:06,00:43:54:25,"This is a place where there is cattle,","Este es un lugar donde hay ganado,",,
00:43:55:25,00:43:57:19,"Here I want to show you,","Ya por aquí te quiero mostrar,",,
00:43:57:19,00:44:00:03,They are Wayuú fishermen.,son pescadores wayú.,,
00:44:00:05,00:44:02:11,Wayuú fishermen.,Pescadores wayú.,,
00:44:03:21,00:44:07:28,"This place is mythological in Cabo de la Vela
It's called xxxx,","Este lugar es mitológico en el cabo de la Vela
se llama xxxx,",,
00:44:08:20,00:44:10:24,It is the hospital where they cure the fish.,es el hospital donde curan a los peces.,,
00:44:11:11,00:44:13:05,"The fish have an owner, an owner.","Los peces tienen dueño, una dueña.",,
00:44:13:05,00:44:16:03,"She, she, she is the owner and her name is Pulowi.","Ella, ella, ella es la dueña y se llama Pulowi.",,
00:44:17:00,00:44:18:17,She is the owner of the animals.,Ella es la dueña de los animales.,,
00:44:18:17,00:44:20:24,To fish you have to ask for permission.,Para pescar hay que pedirle permiso.,,
00:44:21:03,00:44:21:27,You have to do a,Hay que hacerle un,,
00:44:21:27,00:44:27:15,"ritual and all that, because fish are marine cattle
and those are her flocks.","ritual y todo eso, porque los peces son ganado marino
y esos son los rebaños de ella.",,
00:44:28:01,00:44:31:20,"So
when the fishermen hit them with a harpoon","Entonces
cuando los pescadores le dan con un arpón",,
00:44:31:21,00:44:34:17,"or a hook and a fishmonger, they are cured there.","o un anzuelo y un pescaderio, los cura allí.",,
00:44:35:08,00:44:38:09,That place that is on the cabo.,Ese lugar que está en el cabo.,,
00:44:38:10,00:44:40:15,"From here,","De aquí,",,
00:44:41:27,00:44:44:02,They are tombs...,son tumbas…,,
00:44:47:13,00:44:49:14,and then in the,y entonces en el,,
00:44:49:15,00:44:52:03,"sea, in the cape, these are the jepira
a mythological place","mar, en el cabo, estos son los jepira

un lugar mitológico",,
00:44:52:04,00:44:57:05,"in the cape, the children there in the cape,","en el cabo, los niños allá en el cabo,",,
00:44:57:09,00:44:58:03,"this is there in the cape,","esto es allá en el cabo,",,
00:44:59:23,00:45:01:15,"This is Bahia Onda, this is Bahia Onda, a place too, this","este es bahía onda, este es bahía onda un lugar también, este",,
00:45:01:16,00:45:04:28,It was a tour of all of Guajira.,fue un recorrido por toda la Guajira.,,
00:45:05:02,00:45:09:14,"in the Macuira, the Macuira","en la Macuira, la Macuira",,
00:45:11:15,00:45:11:29,"Ah, this is a","Ah, este es un",,
00:45:11:29,00:45:13:18,"mythical place, this was,","lugar mítico, este era,",,
00:45:14:05,00:45:16:06,She was the first Wayuú woman.,era la primera mujer wayú.,,
00:45:16:07,00:45:17:28,"One of the first women,","Una de las primeras mujeres,",,
00:45:17:29,00:45:20:17,"I had a dentated vagina, she","tenía la vagina dentada, no",,
00:45:20:18,00:45:23:28,"Couldn’t have relations with anyone,
could not be reproduced","podía tener relaciones con ningún,
no se podía reproducir",,
00:45:24:13,00:45:26:21,and some wayuú twins,y unos gemelos wayuú,,
00:45:27:03,00:45:31:15,"they shot them with an arrow
and all her teeth were blown out.","le tiraron con una flecha
y le volaron todos los dientes.",,
00:45:31:16,00:45:34:24,"So, that is a very beautiful myth.","Entonces, ese es un mito muy bello.",,
00:45:34:25,00:45:35:12,"It's called Wolunka,","Se llama Wolunka,",,
00:45:36:10,00:45:38:10,Wolunka the woman with,Wolunka la mujer de,,
00:45:38:11,00:45:39:24,the toothed vagina.,la vagina dentada.,,
00:45:41:14,00:45:43:17,"This is the stone that I tell you,","Este es la piedra que yo te digo,",,
00:45:43:18,00:45:44:16,"Aalasü,","Aras,",,
00:45:44:17,00:45:47:09,"There are all the irons, chlamys,
emblems, look at them,","ahí están todos los hierros, clámides,
los emblemas, velos,",,
00:45:47:10,00:45:50:11,"They are there,

Are they there?
Written there, there they are. Yeah.","Ahí están,

¿Ahí están?
Escritos ahí, ahí están. Sí.",,
00:45:50:13,00:45:53:15,"Oh, yeah. and does","Oh, sí. ¿y hace",,
