Start Time,End Time,EN,ES,Highlight,Comments
00:00:04:12,00:00:06:12,What I wanted to say about the land,Lo que quería decir de la tierra,,
00:00:06:13,00:00:07:28,"Mma in the case of the Wayú,","Mma en el caso de los wayú,",,
00:00:07:28,00:00:09:29,is that without a doubt she is,es que sin duda es,,
00:00:11:10,00:00:13:27,"the mother of living beings,","la madre de los seres vivientes,",,
00:00:13:28,00:00:17:22,"of some of them, those who are over it,
because there are other beings like the stars.","de algunos, los que están sobre ella,
porque hay otros seres como los astros.",,
00:00:18:10,00:00:19:09,and other beings,y otros seres,,
00:00:19:10,00:00:20:20,"that are not from her, the sea itself","que no son ella, el mar mismo",,
00:00:20:20,00:00:24:12,"It's not her, it's a sister.","No es ella, es una hermana.",,
00:00:24:13,00:00:28:23,"In the Wayú conception,
she has a capacity of transformation","En la concepción wayú,
ella tiene una capacidad de transformación",,
00:00:28:24,00:00:32:05,"of beings, because the Earth is mysterious","de los seres, porque la tierra es misteriosa",,
00:00:33:14,00:00:38:02,"and when she is mysterious, we do not know her will","y cuando es misteriosa, que desconocemos su voluntad",,
00:00:38:03,00:00:42:27,"to transform or to change, transform
what’s on it.","de transformar o de cambiar, transforma
lo que está sobre ella.",,
00:00:42:28,00:00:46:21,"And humans are part of that,
but also the animals, the plants.","Y los humanos son parte de eso,
pero también los animales, las plantas.",,
00:00:47:15,00:00:50:13,"So the Wayuú have that notion
of the mysteriousness of the earth.","Entonces lo wayuú tienen esa noción
de lo misterioso de la tierra.",,
00:00:51:12,00:00:53:25,"Sometimes it's reckless,","A veces es imprudente,",,
00:00:53:26,00:00:57:28,"sometimes it's reckless,","a veces es imprudente,",,
00:00:57:29,00:01:01:08,"curious, confused, curious","curiosa, confusa, siente curiosidad",,
00:01:03:18,00:01:05:19,"and unpredictable, and","y impredecible, y",,
00:01:07:00,00:01:08:06,There are times when,tiene épocas en que se,,
00:01:08:06,00:01:11:24,"faints like a woman, lifeless,","desmaya como una mujer,exánime,",,
00:01:12:08,00:01:15:21,"In the summer, in the drought, the earth faints.","en el verano, en la sequía, la tierra se desmaya.",,
00:01:16:10,00:01:19:28,"Then Lluvia (rain), which is a
being masculine, hyper masculine,","Entonces Lluvia, que es un
ser masculino, hiper masculino,",,
00:01:21:18,00:01:23:26,appears and it rains.,aparece y llueve.,,
00:01:24:22,00:01:26:28,that rain,Esa lluvia,,
00:01:27:01,00:01:29:24,Wakes her up from her fainting,hace que ella despierte del desmayo,,
00:01:30:12,00:01:34:07,And she explodes all her vitality.,y explote en toda su vitalidad.,,
00:01:34:08,00:01:37:17,"The trees shed leaves, flowers, fruits.","Los árboles echan hojas, flores, frutos.",,
00:01:37:24,00:01:40:03,Animals reproduce,"Los animales se reproducen,",,
00:01:40:05,00:01:41:11,humans also,los humanos también se,,
00:01:41:11,00:01:43:03,reproduce and their,reproducen y sus,,
00:01:43:03,00:01:45:12,"living conditions are greater,","condiciones de vida son mayores,",,
00:01:45:28,00:01:48:22,They are better because today,son mejores porque hoy,,
00:01:48:23,00:01:50:22,everything is abundant.,todo es abundante.,,
00:01:51:05,00:01:53:29,So there,Entonces allí,,
00:01:54:00,00:01:56:15,"we have to see the earth, separating it","tenemos que ver a la tierra, separándola",,
00:01:56:16,00:01:59:29,a bit of the stereotype that has been created,un poco del estereotipo que se ha creado,,
00:02:01:02,00:02:05:18,"sometimes from environmentalist sectors,
sometimes in indigenous peoples themselves","a veces de sectores ambientalistas,
a veces en propios pueblos indígenas",,
00:02:05:19,00:02:09:19,who have also idealized that and,que han idealizado también eso y,,
00:02:11:11,00:02:14:00,something starts forming,se va formando algo,,
00:02:14:01,00:02:16:01,"something we have called global neo-shamanism,","que hemos llamado el neo chamanismo global,",,
00:02:17:12,00:02:21:19,"which is sometimes an idealization
of indigenous peoples and sometimes","que a veces es una idealización
de los pueblos indígenas y a veces",,
00:02:21:20,00:02:27:04,"we erase borders, as if all indigenous
people think the same and they do not think the same.","es borrar las fronteras, como si todos los pueblos
indígenas pensaran lo mismo y no piensan lo mismo.",,
00:02:27:23,00:02:30:10,"Only here, in La Guajira, a few","Sólo aquí, en La Guajira, a pocos",,
00:02:30:11,00:02:33:04,"kilometers, there are the iwa, the Kogi.","kilómetros, están los iwa, los Kogi.",,
00:02:33:14,00:02:34:23,and the wayuú,Y los wayú,,
00:02:34:23,00:02:36:26,They are here at a few kilometers from them.,"estan aquí al pie, a pocos kilómetros de ellos.",,
00:02:37:12,00:02:41:10,They both have completely different cosmologies.,Los dos tienen cosmologías distintas,,
00:02:41:11,00:02:44:29,"And within the Wayú themselves there are also,
Is it different or more or less?","¿y dentro los propios wayú  también hay,
es diferente o más o menos?",,
00:02:45:19,00:02:49:29,"They share it, only there are geo-environmental nuances,","La comparten, solo que hay matices geo ambientales,",,
00:02:50:00,00:02:53:16,"For example,
the stories among the peoples of the sea","por ejemplo,
las narraciones entre los pueblos del mar",,
00:02:54:06,00:02:57:20,"They emphasize marine elements,
for the sea, the","enfatizan los elementos marinos,
para la mar, el",,
00:02:57:21,00:02:59:09,"fisherman,","pescador,",,
00:02:59:10,00:03:03:04,"pastors tend to have that,
but it is the same, that is, they have elements.","los pastores tienden a tener eso,
pero es la misma, o sea, tienen elementos.",,
00:03:03:05,00:03:07:23,"What happens there is a beautiful concept,
who was attributed by","Lo que ocurre allí es un concepto hermoso,
que lo acuñó",,
00:03:07:24,00:03:12:22,"an American psychologist,
They are called dogmatic neighborhoods.","un psicólogo norteamericano,
se llaman los vecindarios doxásticos.",,
00:03:13:21,00:03:15:29,It means that the knowledge,Quiere decir que el conocimiento,,
00:03:16:00,00:03:18:19,"is not universal, it is distributed in neighborhoods.","no es universal, está distribuido en vecindarios.",,
00:03:19:08,00:03:22:20,"The same myth can have its variation if it is
collected","Un mismo mito puede tener una variación si lo
recoges",,
00:03:22:21,00:03:26:15,"inside the territory
that if you pick it up on the seashore, where the fishermen","adentro del territorio
que si lo recoges a orillas del mar, en donde los pescadores",,
00:03:27:14,00:03:28:04,are going to add,le van a poner,,
00:03:28:04,00:03:32:16,"a very marine environment,","un entorno muy marino,",,
00:03:32:18,00:03:37:11,"and that allows us to see
how these narratives have their variations.","y eso nos permite ver
cómo estas narraciones tienen variantes.",,
00:03:37:12,00:03:40:11,That kind of things.,Ese tipo de cosas.,,
00:03:40:26,00:03:45:01,"So for me it is key
then put as emphasis","Entonces, para mí es clave
entonces poner como énfasis",,
00:03:45:02,00:03:48:10,"that, that, first,","eso, eso de, primero,",,
00:03:48:11,00:03:51:23,"indigenous peoples have cosmologies
differentiated.","los pueblos indígenas tienen cosmologías
diferenciadas,",,
00:03:51:24,00:03:54:09,Some peoples have cosmogonies,algunos pueblos tienen cosmogonías,,
00:03:55:02,00:03:57:24,and others have cosmologies,y otros tienen cosmologías,,
00:03:57:25,00:03:59:24,and the difference is key.,y la diferencia es clave.,,
00:03:59:25,00:04:03:08,"Those who are interested in
the origin of the universe,","Aquellos pueblos
que están interesados en el origen del universo,",,
00:04:03:09,00:04:06:16,"in the creation stories of the universe,
They one type of people.","en las historias de creación del universo,
son unos pueblos.",,
00:04:08:00,00:04:12:07,"The Greeks were very interested
in cosmogonies.","Los griegos estuvieron muy interesados
en las cosmogonías.",,
00:04:12:08,00:04:16:01,"The Theogony of Sidon is the story of the gods
and how the world was formed","La Teogonía de Sidón es la historia de los dioses
y de cómo se formó",,
00:04:16:02,00:04:18:19,and makes a genealogy of the gods.,todo el mundo y hace una genealogía de los dioses.,,
00:04:19:04,00:04:23:19,"In the Wayuú world
is more cosmological, they are more curious","En el mundo
wayuú es más cosmológico, está más preocupado",,
00:04:23:20,00:04:29:03,"About the transformation of the universe,
for the modeling of the universe than for its creation.","por la transformación del universo,
por la modelación del universo que por su creación.",,
00:04:29:17,00:04:31:26,"Yes, there are creation narratives.","Sí, hay narraciones sobre creación.",,
00:04:31:27,00:04:34:25,"There may be, but it is not an oral set.","Puede haberla, pero no es un conjunto oral.",,
00:04:34:26,00:04:37:00,"When one examines hundreds of myths,","Cuando uno examina centenares de mitos,",,
00:04:37:25,00:04:41:16,"one begins to find that the emphasis and everything is
in the transformative.","uno empieza a encontrar que el énfasis y todo está
en lo transformativo.",,
00:04:41:17,00:04:44:07,"In fact, they have notions of transformative times","De hecho, tienen nociones de tiempo transformativo",,
00:04:44:25,00:04:49:08,"and they are very interested if their narratives
are about how the universe transforms.","y está muy preocupado si sus narraciones
es cómo el universo se transforma.",,
00:04:49:26,00:04:52:01,That is the big concern.,Esa es la gran preocupación.,,
00:04:52:02,00:04:55:13,"So the explanation
that they give to the world, including the Earth,","Entonces, la explicación
que dan al mundo, incluida la Tierra,",,
00:04:57:00,00:05:00:08,is that,es la de que,,
00:05:00:09,00:05:05:11,"the world has two elements
the physical element, which is the appearance of beings,","el mundo tiene dos elementos
la fisicalidad, que es la apariencia de los seres,",,
00:05:05:12,00:05:06:01,morphology.,morfología.,,
00:05:06:01,00:05:09:24,"That banana that is there, for example, he
has an appearance","Ese plátano que está ahí, por ejemplo, él
tiene una apariencia",,
00:05:09:25,00:05:14:18,"that we are seeing, but they have an interior element,
an interiority","que estamos viendo, pero tienen una interioridad,
una interioridad",,
00:05:15:02,00:05:19:19,"that lives within physicality,
which is the capacity","que habita adentro de la fisicalidad,
que es la agencia,",,
00:05:19:20,00:05:22:26,"the ability to see the universe, to have","la capacidad de ver el universo, de tener",,
00:05:22:27,00:05:25:06,a point of view on the universe,un punto de vista sobre el universo,,
00:05:25:28,00:05:27:29,and to act in the universe.,y de actuar en el universo.,,
00:05:29:22,00:05:32:20,"Much of Western thought,
which is also derived from the Greeks,","Mucho del pensamiento occidental,
que además se deriva de los griegos,",,
00:05:33:17,00:05:37:21,sees some beings as a backdrop.,ve algunos seres como un telón de fondo.,,
00:05:38:07,00:05:40:22,"Like... like Aristotle said,","Como... como dijo,",,
00:05:42:00,00:05:44:16,He considered plants to be the least,como lo consevió Aristóteles las plantas,,
00:05:44:17,00:05:49:29,"who lack intellect
and emotions,","son los menos que carecen de intelecto
y de emociones,",,
00:05:50:00,00:05:53:25,"there are humans,
then the animals, in the Wayuú world it is the other way around.","están los humanos,
luego los animales, en el mundo wayú es al revés.",,
00:05:54:12,00:05:56:06,Plants are naturally wise beings,Las plantas son los seres sabios por naturaleza,,
00:05:57:24,00:05:58:16,They,Ellas,,
00:05:58:16,00:06:00:25,They are the wise ones and then the animals and,son las sabias y luego los animales y,,
00:06:00:26,00:06:02:11,then the humans.,luego los humanos.,,
00:06:02:12,00:06:05:03,That they are the dumbest in the universe.,Que son los más tontos del universo.,,
00:06:05:28,00:06:10:27,Why are plants wiser? They are wiser,"¿Porqué son más sabias las plantas?, son más sabias",,
00:06:10:28,00:06:15:16,"because they were humans in the past
that were transformed.","porque eran humanos en el pasado
que fueron transformados.",,
00:06:16:11,00:06:17:27,Everyone was human.,Todo el mundo era humano.,,
00:06:17:28,00:06:19:11,The entire universe was human.,Todo el universo era humano.,,
00:06:19:11,00:06:24:14,"The stars, the winds,
the animals, everything was human.","Los astros, los vientos,
los animales, todo era humano.",,
00:06:25:11,00:06:27:21,"And suddenly, by Mma,","Y de repente, por Mma,",,
00:06:27:22,00:06:31:19,"the Earth, which is mysterious,
because he fought with Palaa,","la tierra, que es misteriosa,
porque se peleo con Palaa https://www.umng.edu.co/la-universidad/isashii-palaa,",WHITE (8),
00:06:33:01,00:06:35:11,because there were floods from,porque hubo inundaciones a partir de,,
00:06:35:12,00:06:38:12,"that Palaa, the sea, invaded the Earth","que xxxx, la mar, invadió a la tierra",,
00:06:40:04,00:06:42:00,"his sister, they fight.","su hermana, se pelean.",,
00:06:42:01,00:06:44:18,Because there are beings that transform.,Porque hay seres que son transformadores.,,
00:06:44:22,00:06:48:18,"When someone breaks a rule,
the very violent like a jaguar,","Cuando alguien quebranta una norma,
el jaguar muy violento,",,
00:06:48:19,00:06:52:22,"a human was turned into a jaguar for his desire
for violence,","un humano, fue convertido en jaguar por su afán
por la violencia,",,
00:06:52:23,00:06:57:03,"the war, the blood. The crows,","la guerra, la sangre. Los cuervos,",,
00:06:57:04,00:06:59:21,the carrion birds that were,las aves carroñeras que eran,,
00:07:00:12,00:07:04:21,"Wayuú shepherds who liked meat,
They ate the entire flock,","wayú pastores que les gustaba la carne,
se comieron todo el rebaño,",,
00:07:05:00,00:07:08:01,"then they ate any dead animal
that they found,","luego se comían cualquier animal muerto
que encontraban,",,
00:07:08:14,00:07:12:23,"They were uncontrollable
their obsession with meat were transformed","eran incontrolables,
su obsesión por la carne fueron transformados",,
00:07:12:24,00:07:16:25,"in the buzzards, in the crows that we see today
who eat rotten meat.","en los gallinazos, en los cuervos que vemos hoy
que comen carne podrida.",,
00:07:17:18,00:07:20:06,"The snake, the rabbit, because it was very sad,","La serpiente, el conejo, porque era muy triste,",,
00:07:21:08,00:07:24:08,"He was mischievous and they transformed him. Anyway,","hacía travesuras y lo transformaron. En fin,",,
00:07:24:10,00:07:27:28,"then all those stories of the Wayuú
They show us the transformation,","entonces todos esos relatos de los wayú
nos muestran la transformación,",,
00:07:28:19,00:07:31:06,but from the transformation we move to the current world.,pero de la transformación pasamos al mundo actual.,,
00:07:31:27,00:07:34:21,"The world as we see it today,","El mundo como lo vemos actualmente,",,
00:07:34:22,00:07:36:28,then the plants,"entonces, las plantas",,
00:07:37:25,00:07:42:01,"When they transformed from being humans,
that their arms turned into leaves,","cuando se transformaron como humanos,
que sus brazos se convirtieron en hojas,",,
00:07:42:02,00:07:47:18,"their legs in stems and in roots,
They stayed in the place where they were assigned.","sus piernas en tallos y en raíces,
se quedaron en el lugar en donde les fue asignado.",,
00:07:49:07,00:07:50:24,"They are peaceful,","Son pacíficas,",,
00:07:50:25,00:07:53:25,"They don't attack anyone, they don't mess with anyone.","no atacan a nadie, no se meten con nadie.",,
00:07:54:16,00:07:56:23,This doesn't happen to animals or humans.,Esto no le pasa ni a los animales ni a los humanos.,,
00:07:57:06,00:08:01:00,"So, that desire for pacifism,","Entonces, esa voluntad de pacifismo,",,
00:08:01:22,00:08:05:02,"that ability to stay in the place that suits you
was assigned,","esa capacidad de quedarse en el lugar que le
fue asignado,",,
00:08:05:03,00:08:08:03,"Well, in these cosmological notions
the world has an order,","pues en estas nociones cosmológicas
el mundo tiene un orden,",,
00:08:08:23,00:08:11:08,"the world has an order,","el mundo tiene un orden,",,
00:08:11:16,00:08:13:17,Even the rain has an order.,hasta la lluvia tiene un orden.,,
00:08:13:18,00:08:16:28,"The rain must water in an way
and the intensity of its fall","La lluvia debe regar en orden
y la intensidad de su caída",,
00:08:16:29,00:08:20:11,"must be gradual,
and then all that is an order.","tiene que ser gradual,
y entonces todo eso es un orden.",,
00:08:21:15,00:08:23:22,For this reason they are considered the wisest beings,Por ello se les considera los seres más sabios,,
00:08:24:09,00:08:25:24,that is in nature.,que hay en la naturaleza.,,
00:08:25:24,00:08:28:11,"And when the Wayú fight for land,","Y cuando los wayú pelean por tierras,",,
00:08:29:07,00:08:33:04,"displaced persons, for example, violence,
the Wayuú tell him","desplazados, por ejemplo, violencia,
los wayú le dicen",,
00:08:33:05,00:08:37:06,"you have to be like the plants
that they do not dispute the lands with anyone.","hay que ser como las plantas
que no disputan las tierras con nadie.",,
00:08:37:07,00:08:40:09,"They stayed in the place they told them,
this is your place and from there","Se quedaron en el lugar que le dijeron,
este es tu lugar y de ahí",,
00:08:41:13,00:08:43:09,They live and,vive y,,
00:08:43:10,00:08:44:14,there are.,allí está.,,
00:08:44:15,00:08:49:12,"But the plant also preserves
a residual humanity that dwells within her.","Pero también la planta conserva
una humanidad residual que habita dentro de ella.",,
00:08:50:01,00:08:53:08,"That past, not that past
but that transhistorical time,","Ese pasado, no ese pasado
sino ese tiempo trans histórico,",,
00:08:53:09,00:08:56:24,"because it is not a notion of the past,
present and future","porque no es una noción de pasado,
presente y futuro",,
00:08:56:25,00:08:58:27,"as in the West,","como en Occidente,",,
00:08:58:28,00:09:02:20,"that linear vision,
It is a vision of discontinuous time","esa visión lineal,
es una visión de tiempo discontinuo",,
00:09:03:01,00:09:07:23,"and other complex shocks of time,
which is not cyclical time.","y otras conmociones complejas de tiempo,
que no es el tiempo cíclico.",,
00:09:08:04,00:09:12:16,"No, that's linear time that goes around,
It's the same linear time, but it goes around.","No, ese es un tiempo lineal que da vueltas,
es el mismo tiempo lineal, pero da vueltas.",,
00:09:12:29,00:09:16:02,"These are discontinuous times,","Estos son tiempos discontinuos,",,
00:09:17:07,00:09:19:27,"times that may be ahead,","tiempos que pueden estar adelante,",,
00:09:19:28,00:09:23:25,"times that can be parallel
with everyday time","tiempos que pueden ser paralelos
con el tiempo cotidiano",,
00:09:23:26,00:09:28:29,"and times that are referential, that tell us
we must refer to the order","y tiempos que son referenciales, que nos dicen
hay que remitirnos al orden",,
00:09:29:22,00:09:31:09,of this time,de este tiempo,,
00:09:32:01,00:09:33:08,that is there.,que está allí.,,
00:09:34:06,00:09:36:22,"So with the dream,","Entonces, con el sueño,",,
00:09:37:20,00:09:40:00,"the ritual, the landscape,","el ritual, el paisaje,",,
00:09:41:00,00:09:43:08,"that time is accessible to the current time,","ese tiempo es accesible al tiempo actual,",,
00:09:45:16,00:09:48:24,"for the stories, for the history, for the visual.","por los relatos, por la historia, por lo visual.",,
00:09:49:16,00:09:53:06,"So every tree, every plant has that
and the animals too.","Entonces cada árbol, cada planta tiene eso
y los animales también.",,
00:09:53:25,00:09:57:25,"In fact, it is believed that they had knowledge,
They practiced their trade.","De hecho se cree que ellos tenían conocimiento,
practicaban oficio.",,
00:09:58:24,00:10:03:06,"The spider wove and taught humans
to knit, to women.","La araña tejía y enseñó a los humanos
a tejer, a las mujeres.",,
00:10:03:22,00:10:05:18,"The jaguar knew how to wage war,","El jaguar sabía hacer la guerra,",,
00:10:05:18,00:10:09:14,we know the war for them.,sabemos la guerra por ellos.,,
00:10:09:15,00:10:13:02,"Corn was a farmer, just like the bean,","El maíz era un agricultor, igual que el frijol,",,
00:10:13:09,00:10:15:11,We learn agriculture from them.,aprendemos la agricultura de ellos.,,
00:10:16:02,00:10:19:13,"Music came to us from animals or trees,","La música se nos vino de los animales o de árboles,",,
00:10:19:20,00:10:23:29,like the flute from which we get the wood.,como la flauta de donde sacamos la madera.,,
00:10:24:00,00:10:28:01,"In short, jobs and human institutions
They are a legacy,","En fin, los oficios y las instituciones humanas
son un legado,",,
00:10:28:29,00:10:31:17,"a legacy, from other living beings,","un legado, de otros seres vivientes,",,
00:10:32:02,00:10:35:25,"most of which are not human,
They are not human.","la mayoría de los cuales no son humanos,
no son humanos.",,
00:10:47:06,00:10:49:03,"So,","Entonces,",,
00:10:49:27,00:10:51:12,let's say for,digamos para,,
00:10:51:13,00:10:57:00,"To explain it this way, they are notions of the Wayuú world
that have to do with the role of the Earth","explicarlo así, son nociones del mundo wayú
que tienen que ver con el papel de la tierra",,
00:10:57:11,00:10:58:24,"like a being,","como un ser,",,
00:10:58:25,00:11:02:15,"a maternal, feminine, large being, who somehow","un ser materno, femenino, grande, que de alguna manera",,
00:11:02:16,00:11:07:15,"She is the mother of us all,
but that sometimes arises in a stereotype.","es la madre de todos nosotros,
pero que a veces se plantea en un estereotipo.",,
00:11:07:16,00:11:09:18,like that being,Como ese ser,,
00:11:09:19,00:11:12:08,"wise, infallible, pure.","sabio, infalible, puro.",,
00:11:12:17,00:11:16:11,"No, she is a being with generous traits,","No, es un ser con rasgos de generoso,",,
00:11:16:12,00:11:21:29,"fertile, gives life, but mysterious and reckless.","fértil, da vida, pero misteriosa e imprudente.",,
00:11:22:00,00:11:25:22,"May fall into disputes.
When the Wayuú see climate change","Puede caer en disputas.
Cuando los wayú ven el cambio climático",,
00:11:26:04,00:11:29:07,and when the Wayuú talk about coastal erosion,y cuando a los wayú hablan de la erosión costera,,
00:11:29:08,00:11:33:04,"and all this warming, they see it as wars,","y todo esto del calentamiento, lo ven como guerras,",,
00:11:33:25,00:11:37:08,"tensions between Palaa and Mma, the Earth.","tensiones entre xxxx y xxxx, la tierra.",,
00:11:38:26,00:11:40:10,They keep those tensions and,Ellas guardan esas tensiones y,,
00:11:40:11,00:11:43:18,those tensions that are in time.,esas tensiones que están en el tiempo.,,
00:11:44:12,00:11:48:04,"It’s not like it just happened and the collapse comes,","Lo que acaba de ocurrir, viene el colapso,",,
00:11:48:22,00:11:51:05,The world is going to end for the first time.,se va a acabar el mundo por primera vez.,,
00:11:51:07,00:11:53:12,"No, they say, that's old,","No, ellos dicen, eso es viejo,",,
00:11:54:09,00:11:58:27,"we know that they have tensions
and that there may be times when","nosotros sabemos que ellas guardan tensiones
y que pueden haber tiempos en que",,
00:12:00:06,00:12:01:16,Palaa invades,xxxx invade,,
00:12:01:17,00:12:06:23,"and they show us the snails, the shells
that are inside the Earth and the Sea is far away","y nos muestran los caracoles, las conchas
que están adentro de la tierra y el mar está lejos",,
00:12:06:24,00:12:09:13,"and says look, this is proof that Mma,","y dice mira, esto es una prueba de que xxxx,",,
00:12:10:00,00:12:12:26,"that the sea had invaded the land
so long ago.","de que el mar había invadido la tierra
hace tanto tiempo.",,
00:12:14:05,00:12:16:08,Yeah.,Si.,,
00:12:16:10,00:12:29:12,"So, well, that's how to introduce","entonces, bueno, eso es como para introducir",,
00:12:29:13,00:12:33:01,"what we can talk about,
to give you a vision.","en lo que podemos hablar,
para darte una visión.",,
00:12:33:26,00:12:35:08,Yes.,Sí.,,
00:12:35:08,00:12:37:15,Original of all this town,Original de todo este pueblo,,
00:12:37:26,00:12:38:16,"Well,","Bueno,",,
00:12:39:08,00:12:40:22,"many of the things you have said,","muchas de las cosas que has dicho,",,
00:12:40:22,00:12:42:02,that's true.,eso es cierto.,,
00:12:42:03,00:12:45:17,"and I have been living in Peru,","y yo he estado viviendo en Perú,",,
00:12:45:18,00:12:50:01,"and I was noticing a lot about people
there, friends that I was making.","y me estaba dando cuenta de mucho de las personas
allí, amigos que yo estaba haciendo.",,
00:12:51:00,00:12:53:17,they had a different relationship with the Earth.,Tenía una relación diferente con la Tierra.,,
00:12:53:18,00:12:54:10,Clear.,Claro.,,
00:12:54:14,00:12:58:02,"And all the moon, the sun.","Y todos los la luna, el sol.",,
00:12:58:12,00:13:02:03,"A relationship between a human,","Una relación de relación entre un humano,",,
00:13:02:04,00:13:06:07,a spiritual being and what I wanted to capture,un ser espiritual y lo que quería plasmar,,
00:13:07:11,00:13:08:18,was in,fue en,,
00:13:08:19,00:13:12:26,"the minds of city people
or Western culture.","la mente de gente de la ciudad
o de la cultura occidental.",,
00:13:13:25,00:13:17:19,"It was that basically

we are killing our mother a little","Fue que pues básicamente

estamos matando un poco a nuestra madre",,
