Start Time,End Time,EN,ES,Highlight,Comments
00:45:54:00,00:45:55:17,"many years?
Many, of course.","muchos años?
Muchos, claro.",,
00:45:55:17,00:46:00:14,"It's a thing that in time,
In mythological time no, they do not have a date,","Es una cosa que en el tiempo,
en el tiempo mitológico no, no tienen una fecha,",,
00:46:00:15,00:46:01:26,but in mythical time.,sino en el tiempo mítico.,,
00:46:01:27,00:46:04:03,"Yes Aalasü,","Si Aras,",,
00:46:04:04,00:46:07:03,"Aalasü, the stone of the marks, that remains","Aras, la piedra de las marcas, eso queda",,
00:46:08:18,00:46:10:04,"close to Siapana,","cerca a Siapana https://www.semana.com/impacto/articulo/siapana-un-proyecto-modelo-y-sostenible/37200/,",,
00:46:10:05,00:46:12:24,"near a place called Wuipa,","cerca a un lugar llamado Wuipa,",,
00:46:14:04,00:46:16:05,Wuipa,Wuipa,,
00:46:17:27,00:46:20:08,It's about six hours from here by car.,queda como a unas seis horas de aquí en carro.,,
00:46:22:10,00:46:27:01,"It is a beautiful place,
but it is a fundamental place for","Es un lugar bello,
pero es un lugar fundamental para los",,
00:46:27:02,00:46:28:21,Wayuú in the world of myth.,wayú en el mundo del mito.,,
00:46:37:06,00:46:37:26,All that,Todo ese,,
00:46:37:26,00:46:39:13,route,recorrido,,
00:46:42:10,00:46:44:20,and I don't know why not here,y no sé porque aquí no,,
00:46:44:21,00:46:49:19,"Did not come out, it should come out quickly my","salió, debería salir rápidamente mi",,
00:46:49:20,00:46:51:18,cemetery because it is there.,cementerio porque está ahí.,,
00:46:51:19,00:46:52:22,"Click here, download PDF.","A velo aquí, descargar PDF.",,
00:46:52:22,00:46:58:03,Charging.,Cargando.,,
00:46:58:04,00:46:59:05,We'll see.,Vamos a ver.,,
00:47:21:06,00:47:23:28,This same book in a more organized PDF.,Este mismo libro en PDF más ordenado.,,
00:47:23:29,00:47:25:02,Better.,Mejor.,,
00:47:25:11,00:47:28:09,"Look, here you have this photo,
I can send it to you by pdf,","Mira, aquí tienes esta foto,
yo te lo puedo mandar por pdf,",,
00:47:28:10,00:47:30:21,"but I don't know if you saw it, you already have it.","pero no sé si ustedes lo vieron, ya lo tienen.",,
00:47:31:03,00:47:35:16,"We already saw what we just showed ourselves,
but that's the same, but in","Ya vimos lo que nos acabamos de mostrar,
pero eso es lo mismo, pero en",,
00:47:36:13,00:47:37:22,"Book shape, right?","Forma de libro, ¿no?",,
00:47:37:22,00:47:39:27,"Book form, sure, but here it is,","Forma de libro, claro, pero aquí está,",,
00:47:40:29,00:47:41:16,Here you must,Aquí debe,,
00:47:41:16,00:47:43:12,"be the Cemetery,","estar el Cementerio,",,
00:47:43:13,00:47:45:26,I don't know why it didn't come out.,no sé por qué no salía.,,
00:47:47:11,00:47:48:26,"This is a mythological place,","Este es un lugar mitológico,",,
00:47:48:26,00:47:50:12,This is The Turtles of Pájara.,Este es Las tortugas de Pájara.,,
00:47:50:12,00:47:52:02,"This is my territory,","Este es mi territorio,",,
00:47:52:03,00:47:54:12,"where the Wayuú took up cattle,","en donde los wayú se hicieron al ganado,",,
00:47:55:03,00:47:57:20,"the cattle for the Wayuú came from the sea,","el ganado para los wayú vino del mar,",,
00:47:57:21,00:47:59:24,They were turtles that turned into cows,eran tortugas que se convertían en vacas,,
00:48:00:12,00:48:03:02,"and fish that turned into goats,","y peces que se convertían en cabras,",,
00:48:03:03,00:48:05:15,then one night they caught them,entonces una noche lo agarraron,,
00:48:05:16,00:48:06:18,and the,y los,,
00:48:07:08,00:48:08:13,they took and,tomaron y,,
00:48:08:13,00:48:10:28,"He converted them, and that is why they were able to have the animals.","los convirtió, y por eso pudieron tener los animales.",,
00:48:55:04,00:48:57:17,Here is my cemetery.,Aquí está mi cementerio.,,
00:49:05:02,00:49:09:05,"look here at the stone from another perspective,
the stone where all the marks are.","mira aquí la piedra desde otra perspectiva,
la piedra donde están todas las marcas.",,
00:49:12:07,00:49:13:04,Serrania of what?,¿Cerrania de que?,,
00:49:13:18,00:49:15:21,"This is in Aalasü,","Esto es en xxxx,",,
00:49:15:22,00:49:16:20,"this is,","esto esta,",,
00:49:16:20,00:49:18:15,"close to la Macuira,","cerca la xxxx,",,
00:49:18:23,00:49:19:17,"not in the Macuira,","no en la xxxx,",,
00:49:19:17,00:49:22:01,"But close. Yes, yes, close.","si no cerca. Si, sí, cerca.",,
00:49:22:29,00:49:25:16,This is here in Carrizales about an hour,Esto sí es aquí en carrizales. Esto está como a una hora,,
00:49:26:03,00:49:29:05,"and a half by car, easy to go.","y media en carro, fácil de ir.",,
00:49:33:01,00:49:36:16,"You have been telling me that the hills themselves,","Me han estado contando de que los cerros mismos,",,
00:49:36:17,00:49:39:24,"the symbols, the plants, they all have a story, right?","los símbolos, las plantas, todos tienen una historia,¿no?",,
00:49:40:00,00:49:41:02,Everything has a meaning.,Todo tiene un sentido.,,
00:49:41:02,00:49:43:05,What would one be like?,¿Cómo sería uno?,,
00:49:44:00,00:49:46:28,How could one capture that in film?,¿Cómo podría uno plasmar eso en cine?,,
00:49:46:29,00:49:50:21,"I mean, would it be someone telling the story more than anything?","Osea, ¿sería alguien contando la historia mas que todo?",,
00:49:50:22,00:49:55:17,"Yes, it would be good if someone told it with that in the background,
Someone would tell it with that in the background.","Sí, sería bueno que alguien lo contara con eso de fondo,
que alguien lo contara con eso de fondo.",,
00:49:56:04,00:50:00:20,"Yes, I'm trying to think of how
We can give our own voice.","Sí, estoy intentando pensar de cómo
podemos dar una voz propia.",,
00:50:00:21,00:50:01:12,That's correct,Así es,,
00:50:01:12,00:50:02:01,"to the thing, right?","a la cosa, ¿No?",,
00:50:02:02,00:50:05:02,"That's right, that's right.","Así es, así es así.",,
00:50:05:16,00:50:08:21,"Because they talk, because I know what they're talking about,
but it's hard","Porque hablan, porque yo sé de que habla,
pero es duro",,
00:50:08:22,00:50:11:18,sometimes show that.,a veces  mostrar eso.,,
00:50:11:24,00:50:12:23,"Of course, of course.","Claro, claro.",,
00:50:12:23,00:50:13:21,The grace is that there is a,La gracia es que haya una,,
00:50:13:21,00:50:16:17,history in each of those places.,historia en cada uno de esos lugares.,,
00:50:17:03,00:50:19:16,Cemeteries also speak to us.,Los cementerios también nos hablan.,,
00:50:20:13,00:50:23:23,"I'm sorry not, I don't know why I didn't find it,","Yo Lástima que no, no sé porque no encontré el,",,
00:50:24:12,00:50:26:05,the book the poem,el libro el poema.,,
00:50:26:06,00:50:31:25,"From this poem, from Vito Apshana, which was so beautiful, that","De este poema , de xxxx, que fue tan bello, que",,
00:50:32:10,00:50:35:24,It seems to me that that also has a huge power,"a mí me parece que también eso tiene una fuerza
muy grande.",,
00:50:37:13,00:50:40:19,"In fact, I think that would be a very good way to","De hecho, yo creo que eso sería muy buena manera de",,
00:50:42:06,00:50:46:08,"make the trees, the hills,
They speak in poems.","hacer que los árboles, los cerros,
hablan por poemas.",,
00:50:46:14,00:50:47:11,"Yes, it is","Sí, es",,
00:50:47:12,00:50:48:21,a little more abstract but oh well.,un poco más abstracto pero bueno.,,
00:50:48:21,00:50:51:08,"Let's see, let's see if I can find it.","Vamos a ver, vamos a ver si lo encuentro.",,
00:50:51:09,00:50:59:13,Ancient newcorners.,antiguos recién llegados.,,
00:51:09:04,00:51:10:26,"But here look,","Pero aquí mira,",,
00:51:10:26,00:51:12:17,"for example, this.",por ejemplo esto.,,
00:51:13:04,00:51:15:07,I wrote this column,Esta columna la escribí yo,,
00:51:15:08,00:51:17:22,and published it in El Espectador.,y la publique  en El Espectador.,,
00:51:17:23,00:51:19:23,"Look at it here, here is this part","Míralo aquí, aquí está esta parte",,
00:51:20:27,00:51:23:26,to explain the relationship of the Wayuú,para explicar la relación de los wayú,,
00:51:24:04,00:51:26:27,"with its land, with its cemetery,","con su tierra, con su cementerio,",,
00:51:26:28,00:51:30:09,"the place of belonging,","el lugar de pertenencia,",,
00:51:30:10,00:51:33:02,"because the Wayuú have a very beautiful notion,","porque los wayú  tienen una noción muy bella,",,
00:51:33:03,00:51:35:13,is the place of birth,está el lugar de nacimiento,,
00:51:35:14,00:51:39:19,"and there is a place of residence
I live here in Riohacha, but this does not belong to me.","y hay un lugar de residencia
yo vivo aquí en Riohacha, pero esto no me pertenece.",,
00:51:40:02,00:51:44:06,"My place of belonging is my cemetery,
that is the place in the world to which","Mi lugar de pertenencia es mi cementerio,
ese el lugar del mundo al cual",,
00:51:44:07,00:51:46:04,"I am assigned, assigned to","yo estoy asignado, adscrito a",,
00:51:46:05,00:51:47:21,that's the place.,ese el lugar.,,
00:51:48:01,00:51:50:01,"Then look at the poem it says,","Entonces mira en el poema dice,",,
00:51:51:19,00:51:53:19,"you were already born, they say","ya naciste, le dicen",,
00:51:54:02,00:51:56:19,"to a wayuú, you were already born","a un wayú, ya naciste",,
00:51:58:04,00:52:00:06,"and you were born the son of people,","y naciste hijo de gente,",,
00:52:01:00,00:52:03:21,"of the founders of Trocha del Cerro Epitsü,","de los fundadores de Trocha del Cerro Epitsü,",,
00:52:05:08,00:52:07:07,and you can go,y puedes irte,,
00:52:07:08,00:52:10:24,"and you may not come back, but you will always be there,","y puedes no volver, pero siempre estarás ahí,",,
00:52:12:02,00:52:14:04,next to the tree Mokoshira,junto al árbol Mokoshira,,
00:52:14:15,00:52:16:14,that surrounds your cemetery,que circunda tu cementerio,,
00:52:16:14,00:52:20:00,and there belongs your shadow and your rest.,y ahí pertenece tu sombra y tu descanso.,,
00:52:20:09,00:52:22:14,"Look at the beauty, ok,","Mira la hermosura, ósea,",,
00:52:22:15,00:52:26:29,"can move. When these
wind farms are arriving in La Guajira,","puede mudarse. Cuando estos
parque eólicos están llegando a la Guajira,",,
00:52:27:15,00:52:29:17,"they are wrong,","ellos están equivocados,",,
00:52:29:18,00:52:32:06,they talk to the people who are there,ellos hablan con las personas que están allí,,
00:52:32:26,00:52:36:11,"and they believe that those who are there are the owners,","y creen que los que están allí son los dueños,",,
00:52:36:12,00:52:40:08,and the owners may be far away because,y los dueños pueden estar lejos porque,,
00:52:41:11,00:52:43:29,"They can live anywhere in the world,","pueden vivir en cualquier lugar del mundo,",,
00:52:44:16,00:52:48:14,"but its territory is there,
that belongs to them, they are assigned there.","pero su territorio es ese,
que les pertenece, están asignados allí.",,
00:52:48:25,00:52:54:12,"The other could be a son,
but children have no right over the land.","El otro puede ser un hijo,
pero los hijos no tienen derecho sobre la tierra.",,
00:52:55:01,00:52:58:06,"Children only have the right
on the land of their mothers.","Los hijos  solo tienen derecho
sobre la tierra de sus madres.",,
00:52:59:04,00:53:02:05,"So a parent can leave them there.
as guardians.","Entonces un padre los puede dejar ahí
como guardianes.",,
00:53:02:14,00:53:04:28,"You take care, but you don't decide about it","Tú cuidas, pero no decides sobre el",,
00:53:04:29,00:53:06:09,territory.,territorio.,,
00:53:06:09,00:53:08:22,"I'm leaving, I am the owner of that territory,","Yo me voy, yo soy el dueño de ese territorio,",,
00:53:09:05,00:53:12:15,"then the son who remains there has the right to live,
but not to decide.","entonces el hijo que queda allí, tiene derecho de a vivir,
pero no a decidir.",,
00:53:13:03,00:53:15:02,So that's a bit of the conflict.,Entonces ese es un poco el conflicto.,,
00:53:15:03,00:53:19:24,"the conflict that is coming,

between the government and….
Of course,
because the companies arrive, oh","el conflicto que está llegando,
entre el gobierno y ….
claro,
porque llegan las empresas, ¡Ay",,
00:53:20:00,00:53:22:25,I spoke to the person who lives there! Wait a minute that's not,yo hablé con el que vive ahí!. Un momento eso no es,,
00:53:22:26,00:53:25:13,"the son’s, nor the grandson’s.","del hijo,ni del nieto.",,
00:53:25:26,00:53:28:23,"His territory is his mother's, not that one, he","El territorio de él es el de la mamá, no ese, él",,
00:53:29:08,00:53:34:01,"there he is taking care. And that's why there are so many conflicts,
for not understanding this.","ahí está cuidando. Y por eso hay tantos conflictos,
por no comprender esto.",,
00:53:34:13,00:53:38:14,"For me, the conflict with companies
and with all this topic","Es que para mí el conflicto con las empresas
y con todo este tema",,
00:53:38:15,00:53:43:01,"on the land, with the mining companies, with the companies
wind, is not understanding","sobre la tierra, con las mineras, con las empresas
eólicas, es no entender",,
00:53:43:18,00:53:45:25,"the sense of the territory,","el sentido del territorio,",,
00:53:46:12,00:53:49:08,"the sense of the trees, the sense of the landscape.","el sentido de los árboles, el sentido del paisaje.",,
00:53:49:21,00:53:54:15,"For the Wayuú the landscape speaks, speaks,
is telling a story,","Para los wayú el paisaje habla, habla,
está contando una historia,",,
00:53:54:16,00:54:00:20,"It is not a decorative thing: it is not a postcard
of beautiful photography to promote tourism, no.","no es una cosa decorativa, no es una postal
de fotografía bella para promover el turismo, no.",,
00:54:01:11,00:54:03:17,The territory is telling you things.,El territorio te está diciendo cosas.,,
00:54:04:07,00:54:07:11,"So when you pass, you read the territory.","Entonces cuando uno pasa, uno lee el territorio.",,
00:54:07:16,00:54:10:23,"The territory is intelligible,
has something to tell you,","El territorio es inteligible,
tiene algo que contarte,",,
00:54:11:02,00:54:15:14,"It has a narrative structure
that's the territory,","tiene una estructura narrativa,
eso es el territorio,",,
00:54:15:17,00:54:19:12,"something that has a narrative structure
whose pages are the floor.","algo que tiene una estructura narrativa
cuyas páginas son el suelo.",,
00:54:20:10,00:54:22:18,"So these companies come in and say,","Entonces estas empresas llegan y  dice,",,
00:54:22:19,00:54:25:26,"here we lie down, we put a bulldozer,
there is no problem,","aquí tumbamos, metemos un buldocer,
no hay ningún problema,",,
00:54:25:27,00:54:30:09,"we set up a tower
and they are tearing out the pages of a territory.","montamos una torre
y están arrancando las páginas de un territorio.",,
00:54:31:09,00:54:31:24,"So,","Entonces,",,
00:54:31:24,00:54:34:25,They don't understand why they are thinking about money.,no entienden porque ellos están pensando en plata.,,
00:54:34:26,00:54:39:23,"These people want money, they are asking for a lot of money
and they reduce it to a matter of money.","Esta gente quiere plata, están pidiendo mucha plata
y lo reducen a un tema de plata.",,
00:54:39:24,00:54:41:14,It is not a money issue.,No es un tema de plata.,,
00:54:41:15,00:54:46:15,"Obviously, money will have some time
to be addressed, but it is not the essential","Obviamente, la plata tendrá algún momento
que abordarse, pero no es lo esencial",,
00:54:46:16,00:54:47:22,"of the problem,","del problema,",,
00:54:49:26,00:55:08:00,not it,no lo,,
00:55:12:14,00:55:13:05,is.,es.,,
00:55:13:06,00:55:15:23,"So see the whole point,","Entonces mira todo el punto,",,
00:55:15:24,00:55:16:26,what's up,que hay,,
00:55:18:27,00:55:21:23,"where there is an ontological disconnection,","en donde hay una desconexión ontológica,",,
00:55:22:16,00:55:25:05,"For example, for companies","por ejemplo, para las empresas",,
00:55:25:21,00:55:28:21,"The winds are a mass of hot air,","los vientos son masa de aire caliente,",,
00:55:29:00,00:55:33:10,"geophysical events, inanimate,
that occur on earth","agestes geofísicos, inanimados,
que se producen en la tierra",,
00:55:33:11,00:55:38:19,"and that can generate energy: for the wayuú,
They are beings that have paths,","y que pueden generar energía: para los wayú,
son seres que tienen caminos,",,
00:55:38:28,00:55:43:08,"temperaments
and that they need to cross those paths.","temperamentos
y que necesitan atravesar esos caminos.",,
00:55:43:09,00:55:47:17,"A wind moves,
He does not live in a place: passes through a place.","Un viento se mueve,
no vive en un lugar, pasa por un lugar.",,
00:55:47:18,00:55:51:23,"And those paths are related to dreams,
They are related to something else.","Y esos caminos están relacionados con los sueños,
están relacionados con otra cosa.",,
00:55:52:05,00:55:57:13,"So how to understand the wind of business,
the wind from wind companies","Entonces, cómo entender el viento de las empresas,
el viento de las empresas eólicas",,
00:55:57:23,00:56:01:14,"and the wayuú wind
They are two different worlds in the cosmos.","y el viento wayú
son dos mundos distintos en el cosmos.",,
00:56:01:15,00:56:03:12,They are different.,Son diferentes.,,
00:56:03:13,00:56:06:10,To make those logics meet,Hacer que esas lógicas se encuentren,,
00:56:06:25,00:56:09:03,"They are disputes about the universe,","son disputas sobre el universo,",,
00:56:09:20,00:56:13:28,"They are not disputes about development,
no, they are disputes about the universe.","no son disputas sobre el desarrollo,
no, son disputas sobre el universo.",,
00:56:13:29,00:56:14:20,"So,","Entonces,",,
00:56:15:18,00:56:18:13,How to make them understand this?,¿cómo hacer que estos entiendan esto?,,
00:56:18:25,00:56:22:06,"Generally the owners of the companies,
Investors are in a hurry","Generalmente los dueños de las empresas,
los inversionistas, tienen prisa,",,
00:56:22:07,00:56:25:21,"they want to see their money
producing, the Wayuú have time","quieren ver su dinero
produciendo, los wayú tienen tiempo",,
00:56:26:22,00:56:28:27,and they want to talk about this,y quieren hablar sobre esto,,
00:56:28:28,00:56:31:07,and understand how this is not going to affect them.,y entender cómo esto no los va a afectar.,,
00:56:31:19,00:56:36:15,"Then there is a disagreement
that, those do not understand","Entonces hay un desencuentro
que, aquellos no entienden",,
00:56:37:01,00:56:39:18,and they don't want to understand.,y no quieren entender.,,
00:56:39:19,00:56:42:13,"They don't want it, they see it as a whim, superstition.","No lo quieren, lo ven como capricho, superstición.",,
00:56:42:14,00:56:44:17,"It's a backward thought,","Es es un pensamiento atrasado,",,
00:56:44:18,00:56:48:25,"we are modernity,
We are the reason and all this.","nosotros somos la modernidad,
somos la razón y todo esto.",,
00:56:49:07,00:56:51:25,"This is science, they are superstition.","Esta es la ciencia, ellos son la superstición.",,
00:56:52:16,00:56:55:01,"So there, in that disagreement about the","Entonces ahí, en ese desencuentro sobre la",,
00:56:55:09,00:56:59:09,"the land, over the territory,
on the landscape, on the wind,","la tierra, sobre el territorio,
sobre el paisaje, sobre el viento,",,
00:56:59:10,00:57:03:05,"about each tree that you are going to cut down and that was alive,","sobre cada árbol que vas a tumbar y que era un ser,",,
00:57:04:10,00:57:06:29,"that's where no, there hasn't been an agreement,","ahí es donde no, no ha habido un encuentro,",,
00:57:07:21,00:57:10:19,there has not been an agreement.,no ha habido un encuentro.,,
00:57:10:27,00:57:14:15,"As practically in theory,
That cannot be resolved","Como prácticamente en teoría,
es que no se puede resolver eso",,
00:57:14:16,00:57:17:07,"that, I don't know, maybe there isn't one.","eso, no sé, tal vez no hay.",,
00:57:17:13,00:57:20:05,"Of course, those are points to understand.","Claro, eso son puntos para entender.",,
00:57:21:25,00:57:24:16,"We would have to see how they dialogue, how they converse.","Habría que ver cómo dialogan, cómo conversan.",,
00:57:24:17,00:57:27:19,"It is always good to talk,
You cannot deny dialogue.","Siempre es bueno dialogar, uno
no se puede negar al diálogo.",,
00:57:27:28,00:57:30:07,You have to think about,Hay que pensar en,,
00:57:31:15,00:57:34:23,"the others, understand each other, sit down, talk","los otros, entenderse, sentarse, conversar",,
00:57:34:27,00:57:38:26,and if one can express that,y si uno le puede transmitir eso.,,
00:57:38:27,00:57:42:00,"But, let's see how it turns out,","Pero, vamos a ver cómo resulta,",,
00:57:42:01,00:57:44:22,"I think that's why the president is coming from. Hopefully
He will achieve it.","creo que a eso viene el presidente. Ojalá
que lo logre.",,
00:57:44:23,00:57:47:04,I don't know how he will do it.,Yo no sé cómo lo hará.,,
00:57:47:05,00:57:52:18,"I think that
literally spending time in the territory","Creo que eso de
literalmente pasar tiempo en el territorio",,
00:57:52:24,00:57:56:15,"out there in a hammock,
the president there with the mosquitoes,","ahí afuera en una hamaca,
el presidente ahí con los mosquitos,",,
00:57:57:16,00:58:01:20,"with the winds here, telling them,
I think that would help a lot.","con los vientos acá, diciéndoles,
creo que eso ayudaría mucho.",,
00:58:01:21,00:58:06:04,"Yes, it helps, of course, he's coming to stay here for a week, a week.","Sí, ayuda, claro, el viene a estar una semana, una semana aquí.",,
00:58:06:08,00:58:08:15,"I was thinking, and I know that","Yo estaba pensando, y yo sé que",,
00:58:09:15,00:58:11:27,"this is not the point,","este no es el punto,",,
00:58:12:05,00:58:15:18,is that it is an ontological and,es que es una cosa ontológica y de,,
00:58:16:19,00:58:17:25,"cosmology more than anything,","cosmología más que todo,",,
00:58:17:25,00:58:21:12,"but I was also thinking, so yeah,","pero también yo estaba pensando,así que sí,",,
00:58:21:13,00:58:24:16,"I come from that scientific ontology, although yes","vengo de esa ontología científico, aunque sí",,
00:58:25:04,00:58:28:07,"I'm very involved in that other thing, but maybe also","estoy muy metido en eso otro, pero tal vez también",,
00:58:29:03,00:58:34:24,"the winds, that is,
If one would put a mill or anything and","los vientos, o sea,
si uno pondría un molino en lo que sea y se",,
00:58:36:16,00:58:37:12,changes.,cambia.,,
00:58:37:12,00:58:39:16,"I mean, that changes the wind.","Osea, eso cambiaba el viento.",,
00:58:40:01,00:58:42:29,"If we are in a semi-desert place, right?","Si estamos en un lugar semidesértico, ¿cierto?",,
00:58:43:00,00:58:44:04,Yes it is.,Si lo es.,,
00:58:44:05,00:58:47:03,"and the winds bring water, they bring humidity","y los vientos traen agua, traen humedad",,
00:58:47:16,00:58:53:20,"and a single, a small change
maybe it could bring down the entire environment.","y un solo,  un pequeño cambio
tal vez podría derrumbar todo el medio ambiente.",,
00:58:53:21,00:58:56:00,So beyond something like that,Entonces más allá que una cosa así,,
00:58:56:01,00:58:58:03,"Of course, the Wayuú already say it","Claro, ya los wayú lo dicen",,
00:58:58:12,00:58:59:27,is one thing we don't know.,es una cosa que no sabemos.,,
00:59:00:06,00:59:04:20,"Why the importance of studies on this,
How does this affect birds?","Por qué la importancia de los estudios sobre esto,
cómo afecta esto a las aves,",,
00:59:05:08,00:59:08:22,"how it affects bats that it also affects them
the,","cómo afecta a los murciélagos que también los afecta
las señales,",,
00:59:09:04,00:59:11:28,the blades of wind energy,las dos aspas de la energía eólica,,
00:59:12:20,00:59:14:23,How does it affect the eyesight of human beings?,¿Cómo afecta a la vista de los seres humanos?,,
00:59:14:24,00:59:16:25,How does it affect the sound they generate?,¿Cómo afecta el sonido que generan?,,
00:59:16:26,00:59:19:20,"Because they generate a low frequency sound, I think,","Porque generan un sonido de baja frecuencia, creo,",,
00:59:19:29,00:59:24:03,"But it has an impact either way.
The electrical conduction lines,","pero de todas maneras
que impacta, las líneas de conducción eléctrica,",,
00:59:24:04,00:59:28:08,"that energy must be released,
that energy can’t be isolated, they have to come out","esa energía hay que sacarla,
esa energía puede estar aislada, tienen que salir",,
00:59:28:09,00:59:33:00,"by electrical conduction lines
which also generate white smog and energy fields.","por líneas de conducción eléctrica
que generan smog blanco también y campos de energía.",,
00:59:33:10,00:59:37:11,"And we must deforest and make roads
to get those lines out.","Y hay que deforestar y hacer carreteras
para sacar esas líneas.",,
00:59:37:21,00:59:41:01,And there will be many people passing by in cars.,Y va a estar mucha gente pasando en carros,,
00:59:41:15,00:59:45:07,"where before it was quiet
and the Wayuú really like their tranquility.","donde antes era tranquilo
y los wayú les gusta mucho su tranquilidad.",,
00:59:45:25,00:59:49:16,They go out for a walk every day,Ellos cada día salen a caminar,,
00:59:49:17,00:59:52:29,"and they see a footprint, a shoe and they know who stepped on it.","y ven una huella, un calzado y saben quién pisó.",,
00:59:53:25,00:59:57:07,"They know how their children walk, the neighbors,","Ellos conocen cómo caminan sus hijos, los vecinos,",,
00:59:58:22,01:00:00:04,They know the…,conocen las…,,
01:00:00:04,01:00:05:02,"The Wayuú have some flip flops, the waireñas, do you know them?
Wayuú footwear and that Wayuú footwear,","los wayú tienen unas chancletas, las waireñas
, ¿la conocen?,
el calzado wayú y ese calzado wayú,",,
