Start Time,End Time,EN,ES,Highlight,Comments
01:00:05:03,01:00:07:15,"Well, they are specialists in tracking footprints.","bueno, ellos son especialistas en rastrear huellas.",,
01:00:08:01,01:00:10:10,That has been his ancient profession.,Eso ha sido su oficio milenario.,,
01:00:11:16,01:00:13:24,"When a deer or a thing,","Cuando un venado o una cosa,",,
01:00:13:25,01:00:18:25,"and they also track human footprints
and they know if I walk and tilt my foot when walking","y ellos también rastrean huellas humanas
y saben si yo camino e inclino al caminar el pie",,
01:00:18:26,01:00:21:28,"to the left, they say ah, there goes so and so,","a la izquierda, dicen ah, ahí va fulano,",,
01:00:21:29,01:00:25:17,because he always walks like that and they know him.,porque él siempre camina así y lo conocen.,,
01:00:25:18,01:00:29:21,"But then they are going to lose that territorial control
because many people are going to pass by","Pero luego ese control territorial lo van a perder
porque van a pasar muchos",,
01:00:29:22,01:00:33:09,"strange vehicles, with strange people
who is not indigenous and","vehículos extraños, con gente extraña
que no es indígena y",,
01:00:33:19,01:00:37:27,"your sense of security, well-being,
will also be affected,","su sensación de seguridad, de bienestar,
se va a ver también afectado,",,
01:00:38:08,01:00:39:26,So we have to see all of that.,entonces todo eso tenemos que verlo.,,
01:00:39:26,01:00:43:24,"On the other hand,
The Wayuú have needs for health, water,","Por otro lado,
los wayú tienen necesidades de salud, de agua,",,
01:00:44:09,01:00:48:03,of productive projects to live their economy.,de proyectos productivos para vivir su economía.,,
01:00:48:21,01:00:49:28,"I don't know what the meeting will be like,","No sé cómo sea el encuentro,",,
01:00:49:28,01:00:53:23,"there will be a dialogue,
I imagine it, and we have to see how that dialogue takes place.","habrá un diálogo,
me imagino yo, y hay que ver cómo se da ese diálogo.",,
01:00:54:10,01:00:55:24,"Yes, yes,","Si, sí,",,
01:00:57:02,01:01:00:08,"you know,","sabes,",,
01:01:01:06,01:01:02:08,It's going to be interesting.,Va a ser interesante.,,
01:01:02:09,01:01:03:10,That's how it is.,Así es.,,
01:01:03:10,01:01:06:13,That makes me happy. The president is coming.,Que me alegra. Que viene el presidente.,,
01:01:06:14,01:01:12:09,"I was living in Popayán
in 2018 and 2019","yo estuve  viviendo en Popayán
en 2018 y 2019",,
01:01:12:23,01:01:15:16,and there were these big protests,y hubo esas protestas tan grandes,,
01:01:15:29,01:01:17:13,"and yes,","y sí,",,
01:01:17:14,01:01:18:14,was very hard.,fue muy duro.,,
01:01:18:15,01:01:20:21,Hard and things,Duro y las cosas,,
01:01:20:22,01:01:25:26,"I think Duque would just have to go talk and that's it,","creo que solo tendría que Duque ir a dialogar y ya,",,
01:01:26:07,01:01:30:02,"but promise, promise and it never came.","pero promesa, promesa y nunca vino .",,
01:01:30:14,01:01:32:26,and they asked him to come.,y lo pedían a él que viniera Él.,,
01:01:32:27,01:01:35:01,and it was just a dialogue.,y no más era un diálogo.,,
01:01:36:07,01:01:37:29,and Petro came this time,y Petro vino esta vez,,
01:01:38:00,01:01:39:00,for own will.,por voluntad propia.,,
01:01:39:01,01:01:41:02,He said he wanted to come to work for a week.,También deseo de venir una semana a trabajar.,,
01:01:41:03,01:01:44:14,"Well, let's see what comes of all this,
because the idea","Bueno, vamos a ver qué resulta de todo esto,
porque la idea",,
01:01:44:15,01:01:47:16,"It is seeing what results, what is achieved.","es ver que resulta, que se logra.",,
01:01:47:17,01:01:49:01,We'll see.,Vamos a ver.,,
01:01:49:01,01:01:51:10,"But it is interesting. No?
Are you going to talk to him too?","Pero es interesante. ¿No?
¿Usted va a hablar con él también?",,
01:01:52:22,01:01:54:29,"No, I prefer to keep distance from power.","No, yo prefiero guardar distancia de el poder.",,
01:01:55:00,01:01:58:20,I prefer to read the news,Yo prefiero leer en las noticias,,
01:01:59:24,01:02:02:02,"They called me from El tiempo (Newspaper),","A mí me llamaron del Tiempo,",,
01:02:02:03,01:02:07:06,"and they called me yesterday from the newspaper
Time and what do you think and then they ask me","y me llamaron ayer del periódico
El Tiempo y que usted que opina y entonces me preguntan",,
01:02:07:07,01:02:08:24,Are you a leader?,¿Usted es un dirigente?,,
01:02:08:25,01:02:12:05,"Are you a defender of human rights?
Are you an indigenous authority? I told them","¿Usted es un defensor de los derechos humanos?,
¿Usted es una autoridad indígena? les dije",,
01:02:12:06,01:02:15:03,"I am a solitary voice, I do not represent anyone.","yo soy una voz solitaria, no represento a nadie.",,
01:02:15:06,01:02:16:03,To anyone.,A nadie.,,
01:02:16:18,01:02:17:05,"What I speak,","Lo que hablo,",,
01:02:17:05,01:02:19:23,"I'll say it for myself, I don't even know if my children listen to me.","lo diré por mí,  no sé ni si mis hijos me hacen caso",,
01:02:21:04,01:02:22:05,I told them.,les dije.,,
01:02:23:02,01:02:25:06,I am not and I do not want to be,Yo no soy y no quiero ser,,
01:02:25:07,01:02:27:05,"leader, nor leader, nor...","líder, ni dirigente, ni…",,
01:02:27:05,01:02:29:09,It's a lot of responsibility.,Es mucha responsabilidad.,,
01:02:29:10,01:02:33:21,"One has enough with one's own life
as to lead another's.","Ya uno tiene suficiente con su propia vida
como para liderar la de otro.",,
01:02:37:28,01:02:39:10,There are some who,Hay unos que,,
01:02:39:29,01:02:44:01,"bring knowledge, there are others who bring leadership.","traen conocimiento, hay otros que traen liderazgo.",,
01:02:44:02,01:02:48:04,You have your role.,Uno tiene su rol.,,
01:02:48:24,01:02:50:19,His role and his role.,Su rol y su papel.,,
01:02:50:20,01:02:53:12,"Yes, that's the idea.","Sí, esa es la idea.",,
01:02:53:13,01:02:58:20,"I wanted to talk to you a little about knowing more,
because well, all that, several of those topics","Te quería hablar un poco de saber más,
porque bueno, todo eso,  varios de esos temas",,
01:02:58:21,01:03:02:10,"I think
We are going to talk more on Tuesday, but about that,","yo creo que
vamos a hablar más en el martes, pero de ese,",,
01:03:04:20,01:03:06:16,from that lineage of,de ese linaje de,,
01:03:06:17,01:03:10:12,"the Wayuú people, of course, are very interesting, what is it about that?","la gente wayú, claro, es muy interesante,¿ que tiene eso?",,
01:03:10:13,01:03:13:22,"Very interesting,
because the Wayuú kinship system","Muy interesante,
porque el sistema de parentesco wayú",,
01:03:14:03,01:03:16:24,It is based on the theory of human procreation.,se basa en la teoría de la procreación humana.,,
01:03:17:13,01:03:19:20,"When a man and a woman have sex,","Cuando un hombre y una mujer tienen relaciones,",,
01:03:20:04,01:03:23:06,"The man contributes with blood,","el hombre hace un aporte que es la sangre,",,
01:03:23:22,01:03:26:27,"the vital blood that causes the child,
semen turns to blood.","la sangre vital que causa al niño,
el semen se vuelve sangre.",,
01:03:27:22,01:03:30:06,"Then the woman provides the meat,","Entonces la mujer aporta la carne,",,
01:03:30:07,01:03:33:28,"the body wrap
where the child is born, the womb.","el envoltorio corporal
en donde nace el niño, el útero.",,
01:03:34:01,01:03:36:24,"So,
When a person is born, they have two families,","Entonces,
cuando una persona nace, tiene dos familias,",,
01:03:37:23,01:03:40:05,"a Oupayu, a father's maternal family","un Oupayu,  https://www.pensamientopenal.com.ar/system/files/2019/05/doctrina47670.pdf
una familia materna del papá",,
01:03:40:18,01:03:45:12,"and the apushi which is the mother's maternal family, then,","y la apushi
que es la familia materna de la mamá, entonces,",,
01:03:47:01,01:03:49:09,This is legally important.,esto es jurídicamente importante.,,
01:03:49:10,01:03:52:06,"If I cause a wound to a Wayuú, I will shoot him,","Si yo le causo una herida a un wayú, yo le disparo,",,
01:03:52:07,01:03:55:29,"I don't kill him, the father collects the blood shed,","no lo mato, el padre cobra la sangre derramada,",,
01:03:56:17,01:04:01:05,"but if I kill it, as flesh is destroyed,
the body,","pero si yo lo mato, como se destruye la carne,
el cuerpo,",,
01:04:01:06,01:04:04:28,then the mother's family is going to come and ask,entonces la familia materna va a venir a pedir,,
01:04:05:02,01:04:07:26,the great compensation for the destruction of the flesh.,la gran compensación por la destrucción de la carne.,,
01:04:08:09,01:04:11:08,"The father can only ask
a small payment of tears.","El padre sólo puede pedir
un pago pequeñito de lágrimas.",,
01:04:11:09,01:04:13:03,"What he has cried, his pain for his son.","Lo que él ha llorado, su dolor por su hijo.",,
01:04:13:03,01:04:18:07,"Then the Father is given compensation
for the little tears and He leaves.","Entonces al Padre se le da la compensación
por las lágrimas pequeñas y Él se va.",,
01:04:18:15,01:04:21:21,"And then the big strong negotiation
It's with the mother's family.","Y luego la gran negociación fuerte
es con la familia de la mamá.",,
01:04:22:08,01:04:25:04,"So the lands, the territory,","Entonces las tierras, el territorio,",,
01:04:25:25,01:04:31:00,"the clan, practically like one's last name
It's the mom's, it's not the dad's,","el clan, prácticamente como el apellido de uno
es el de la mamá, no es el del papá,",,
01:04:31:17,01:04:34:09,So a Wayuú will always have an orientation,entonces siempre un wayú va a tener una orientación,,
01:04:34:10,01:04:39:12,"stronger towards your uterine family
that towards the father's uterine family,","más fuerte hacia su familia uterina
que hacia la familia uterina del padre,",,
01:04:39:22,01:04:43:27,"that is, the mother,
because the father is a boss for minor things,","o sea la mamá,
porque el padre es un jefe para cosas menores,",,
01:04:44:17,01:04:48:09,"the father is a boss in the home,
food, food, education.","el padre es un jefe en el hogar,
la comida, los alimentos, la educación.",,
01:04:48:19,01:04:51:22,"But when a problem is strong,
He is your mother's brother,","Pero cuando un problema es fuerte,
es el hermano de tu mamá,",,
01:04:51:23,01:04:54:11,It's your uncle who is your real boss.,es tu tío el que es tu jefe de verdad.,,
01:04:54:27,01:04:59:00,"That's the boss,
because he is the one who must intervene.","Ese sí es el jefe,
porque él es el que tiene que intervenir.",,
01:04:59:01,01:05:01:08,"If I do something, they look for my uncle, my dad","Si yo hago algo, buscan a mi tío, a mi papá",,
01:05:01:09,01:05:03:28,"no, no, because he is almost a stranger.","no, no, porque él es casi un extraño.",,
01:05:03:29,01:05:05:29,"I mean, it's not from the same group.","Ósea, no es del mismo grupo.",,
01:05:06:14,01:05:10:10,"On the other hand, the lands that belong to my mother,
where my uncles live,","En cambio, las tierras que son de mi madre,
donde viven mis tíos,",,
01:05:10:22,01:05:13:20,"the defense, the cemetery,
everything is a function of the mother.","la defensa, el cementerio,
todo está en función de la madre.",,
01:05:14:09,01:05:17:24,"So, the Wayuú society is matrilineal,
It is oriented towards that.","Entonces, la sociedad wayuú es matrilineal,
está orientada hacia eso.",,
01:05:18:06,01:05:20:18,"The father does have some duties in marriage,","El padre sí tiene unos deberes en matrimonio,",,
01:05:20:23,01:05:24:04,"injuries, these things, and he has a role at a minor level,","heridas, estas cosas, y él tiene un rol a nivel menor,",,
01:05:24:19,01:05:28:11,"well, yes, provide the house with food,
everything any father in the world would do.","bueno, sí, proveer la casa de alimento,
todo lo que cualquier padre haría en el mundo.",,
01:05:28:23,01:05:31:03,"But when the problem is serious, he is out.","Pero cuando el problema es grave, él sale.",,
01:05:31:04,01:05:33:00,"No, it can't be.","No, no puede estar.",,
01:05:33:01,01:05:36:06,"He is his brother-in-law, he is his mother's brother,","Es su cuñado, es el hermano de la mamá,",,
01:05:36:07,01:05:40:04,"the one who is the boss of his nephews,
it's stronger,","el que es el jefe de sus sobrinos,
es más fuerte,",,
01:05:40:05,01:05:43:02,"the uncle nephew father and son relationship.
Really?","la relación sobrino tío que padre e hijo.
¿En serio?",,
01:05:43:21,01:05:45:06,"Of course, of course.","Claro, claro.",,
01:05:45:07,01:05:45:29,Interesting.,Interesante.,,
01:05:45:29,01:05:49:12,"Yes, a Wayuú has to talk about who
They were your uncles and then,","Sí, un wayuú tiene que hablar de quiénes
eran tus tíos y entonces,",,
01:05:50:13,01:05:51:12,"in fact,","de hecho,",,
01:05:51:12,01:05:53:04,"to the uncles, they call the Wayú Ta’laüla","a los tíos, les dicen los wayú Ta’laüla",,
01:05:53:05,01:05:54:28,"I mean, my old man, my boss.","Osea, mi viejo, mi jefe.",,
01:05:54:29,01:05:57:09,That's my uncle. That's how it is said.,Ese es él tío. Así se dice.,,
01:05:57:25,01:05:59:08,It is a very close relationship.,Es una relación muy estrecha.,,
01:05:59:08,01:06:01:19,And in war always fighting,Y en la guerra siempre peleando al,,
01:06:01:20,01:06:04:21,Uncle’s side.,lado de los tíos.,,
01:06:05:03,01:06:06:21,Even if the father's family,Incluso si la familia del padre,,
01:06:06:21,01:06:10:23,"goes to war with the mother's family,
The Wayuú must take their mother's side,","entra en guerra con la familia de la madre,
los wayú tienen que irse del lado de la mamá,",,
01:06:10:24,01:06:13:13,necessarily on that side.,necesariamente de ese lado.,,
01:06:15:07,01:06:19:19,"There is a story in a Wayuú song of a war that took place,","Hay una historia en un canto wayú de una guerra que hubo,",,
01:06:20:25,01:06:25:11,"They loved their father very much, these Wayuú,
and for some reason the families went to war,","ellos querían mucho a su papá, estos wayú,
y por una cosa las familias entraron en guerra,",,
01:06:25:12,01:06:29:03,"that these are long families,
and the father died in combat","que son familias largas,
y el papá murió en un combate",,
01:06:29:23,01:06:32:02,and they asked permission to the enemies,y ellos pidieron permiso a los enemigos,,
01:06:32:03,01:06:34:28,to go cry to their father and they accepted them.,para ir a llorar a su padre y los aceptaron.,,
01:06:35:07,01:06:38:04,"Then they said let's make a truce
so that you can come to cry at your","Entonces dijeron vamos a hacer una tregua
para que ustedes vengan a llorar a su",,
01:06:38:05,01:06:38:22,Dad because he was,Papá porque era,,
01:06:38:22,01:06:42:11,"their dad and peace came because of that, so it's a story","su papá y vino la paz por eso, entonces es una historia",,
01:06:42:27,01:06:46:10,very cute.,muy linda.,,
01:06:46:20,01:06:49:23,"So this must be understood,
Companies do not understand this,","Entonces esto hay que entenderlo,
esto no lo entienden las empresas,",,
01:06:50:12,01:06:55:16,"They don't understand this, they don't understand
this form of kinship and they are, and why?","esto no lo entienden, ellos no entienden
esta forma de parentesco y son ¿y porque?,",,
01:06:55:17,01:06:59:05,what is this? And your last name? and not.,¿y esto qué es? ¿y su apellido? y no.,,
01:07:01:01,01:07:02:22,"This is how the network is woven,","Así se teje la red, la",,
01:07:02:23,01:07:06:05,"wayuú social organization
and that has to do with the land.","organización social wayú
y eso tiene que ver con la tierra.",,
01:07:06:14,01:07:10:00,"The earth is feminine, the earth is feminine,","La tierra es femenina, la tierra es femenina,",,
01:07:10:01,01:07:14:18,"the rain, the rain that fertilizes
the earth is hyper masculine.","la lluvia, él lluvia que fecunda
la tierra es hiper masculino.",,
01:07:15:05,01:07:18:05,"So rain is the most masculine thing there can be,","Entonces lluvia es lo más masculino que puede haber,",,
01:07:18:16,01:07:21:06,"because it is what fertilizes the earth, the earth is what","porquees lo que fertiliza la tierra, la tierra es lo",,
01:07:21:25,01:07:24:09,"what bears, what is fruitful, what is fertile.","lo que pare, lo fructífero, lo fértil.",,
01:07:24:23,01:07:29:01,"The earth is life,
but the masculine is what fertilizes life.","La tierra es la vida,
pero lo masculino es lo que fecunda la vida.",,
01:07:29:10,01:07:33:00,"Then look at all that beautiful relationship
that must be understood.","Entonces mira toda esa relación tan bonita
que hay que entender.",,
01:07:33:21,01:07:36:13,"So for them the earth is fixed,","Entonces, para ellos la tierra es fija,",,
01:07:37:14,01:07:41:11,"This is a place, but the rain is mobile,
the rain is watered","esta un lugar, pero la lluvia es móvil,
la lluvia se riega",,
01:07:42:02,01:07:45:21,"and fertilizes the earth, the lands in plural,","y va fecundando la tierra, las tierras en plural,",,
01:07:45:22,01:07:49:10,"the lands, because each woman is a land.","las tierras, porque cada mujer es una tierra.",,
01:07:50:03,01:07:54:11,"Yes, each territory
It has its own history, its own place,","Si, cada territorio
tiene una historia propia, lugar propio,",,
01:07:54:24,01:07:59:21,"then more than the earth as a unit
that does exist at a mythological level, it is called Mma.","entonces más que la tierra como unidad
que sí existe a nivel mitológico, xxxx se llama.",,
01:08:00:03,01:08:04:01,"There are also
specific lands or places","Existen también
las tierras o los lugares específicos",,
01:08:04:20,01:08:09:13,"to which one is associated
and that are represented in the cemetery housing axis.","a los cuales uno está asociado
y que se representan en el eje vivienda cementerio.",,
01:08:09:15,01:08:13:19,"This is why cemeteries are so important.
and that's why Vito's poem says","Por eso los cementerios son tan importantes
y por eso dice el poema de Vito",,
01:08:13:20,01:08:15:26,"what he said, there is your shadow and you rest.","lo que dijo, ahí está tu sombra y tú descansa.",,
01:08:16:01,01:08:21:10,"You can leave and you can not come back,
but there is the tree in your cemetery.","Podrás irte y podrás no volver,
pero ahí está el árbol en tu  cementerio.",,
01:08:21:11,01:08:22:03,In wayaqui apushi,En wayaqui apushi,,
01:08:24:20,01:08:26:12,"Yes, apushi.","Sí, apushi.",,
01:08:26:13,01:08:30:09,"Yes, apushi is relatives, it is like part,","Si, apushi es parientes, es  como parte,",,
01:08:30:17,01:08:33:17,"It's part uterine relative, yes,","es parte pariente uterino, sí,",,
01:08:33:20,01:08:37:22,"but a nest is like the family unit, not the clan.","pero un nido es como la unidad familiar, no el clan.",,
01:08:37:23,01:08:40:06,The clan is called E´iruku and clan means meat.,El clan se llama E´iruku y el clan quiere decir carne.,,
01:08:41:07,01:08:44:25,Not all members of a clan are family.,No todos los miembros de un clan son familia.,,
01:08:45:11,01:08:46:17,They are like surnames.,Son como apellidos.,,
01:08:46:18,01:08:49:12,Like someone's last name is Smith.,Como si alguien se apellidara Smith.,,
01:08:49:21,01:08:53:10,"There are many Smiths in the world, but those who were born in","Hay muchos Smith en el mundo, pero los que nacieron en",,
01:08:53:16,01:08:56:20,"Cabo de la Vela
They are one and the ones who are in such a place.","el Cabo de la Vela
son unos y los que están en tal lugar.",,
01:08:56:21,01:09:00:19,"So when the land serves as your last name
and you say no,","Entonces cuando la tierra te sirve de apellido
y dices no,",,
01:09:00:27,01:09:03:18,I am Uriana from xxxxx,yo soy Uriana  de Caitamán,,
01:09:04:18,01:09:07:21,"a Wayuú place called like that,
that has a cemetery,","un lugar wayuú que se llama así,
que tiene un cementerio,",,
01:09:07:22,01:09:10:14,"a source of water, a territory, a history.","una fuente de agua, un territorio, una historia.",,
01:09:10:24,01:09:15:22,"It is then, that one is different, those do act in war.
The others can be recognized, Ah!","Es entonces, ese se diferencia, esos sí actúan en guerra.
Los otros se pueden reconocer, ¡Ah!",,
01:09:15:23,01:09:20:10,"We share the clan, but we are not family,
we only have an mythological relationship","compartimos el clan, pero no somos familia,
solo tenemos un parentesco mitológico",,
01:09:21:14,01:09:24:04,and the clan not only of humans.,y el clan no solo de humanos.,,
01:09:24:29,01:09:27:03,"The clan involves non-humans,","El clan involucra no humanos,",,
01:09:28:21,01:09:31:28,because for example,porque por ejemplo,,
01:09:31:29,01:09:35:23,"well, the Uriana ones are from the jaguar and the rabbit,","bueno, los Uriana, son del jaguar y del conejo,",,
01:09:37:01,01:09:39:16,They are animals that belong to the clan.,son animales que pertenecen al clan.,,
01:09:40:02,01:09:42:29,Some hills and some trees.,Algunos cerros y algunos árboles.,,
01:09:43:00,01:09:48:04,"The trees are numerous as is a numerous clan,
The trees that are numerous are from that clan.","Los árboles numerosos como es un clan numeroso,
los árboles que son numerosos, son de ese clan.",,
01:09:48:22,01:09:53:04,"So there are humans, animals and plants
and even hills in one of this clans.","Entonces hay humanos, animales y plantas
y hasta cerros en un clan u otro.",,
01:09:54:04,01:09:58:17,"Well that, that's what you're talking about,
that everything was human.","Bueno eso, eso de que está hablando,
de que todo era humano.",,
01:09:58:19,01:09:59:12,Everything was human.,Todo era humano.,,
01:09:59:13,01:10:02:04,"That's where the kinship comes from, that in time,","De ahí viene el parentesco, de que en el tiempo,",,
01:10:02:15,01:10:05:22,"in the reference time,","en el tiempo referencial,",,
01:10:05:23,01:10:08:19,"Australians have a time called
The Age of Dream","los australianos tienen un tiempo que se llama
La Era del sueño",,
01:10:09:24,01:10:14:08,"and the Coyoacán of Alaska
They have a time called distant time.","y los Coyoacán de Alaska
tienen un tiempo que se llama el tiempo distante.",,
01:10:14:09,01:10:18:07,"The Wayuú call that time wayuu sumaiwa,","Los wayú le llaman a ese tiempo wayuu sumaiwa,",,
01:10:18:23,01:10:21:06,"sumaiwa, at one time,","xxxx, en un tiempo,",,
01:10:21:20,01:10:27:04,"but in the West we tend to confuse that time
with the past, because stories begin like that.","pero en Occidente tendemos a confundir ese tiempo
con el pasado, porque las historias empiezan así.",,
01:10:27:05,01:10:30:20,"There was a time
and people think it's the past, it's not the past.","Hubo un  tiempo
y la gente cree que es el pasado, no es el pasado.",,
01:10:30:21,01:10:34:13,They are transhistorical times that go through history.,Son tiempos transhistóricos que atraviesan la historia.,,
01:10:36:03,01:10:37:15,Native populance,Los  pueblos indígenas,,
01:10:37:15,01:10:40:17,"they can have notions of time
where the past is ahead","pueden tener nociones de tiempo
en que el pasado está delante",,
01:10:41:21,01:10:46:08,"or a mythical time until
forward, forward time or parallel times.","o un tiempo mitico hasta
adelante, tiempo delantero o tiempos paralelos.",,
01:10:46:19,01:10:50:14,"And how do you do it between everyday time
and that time?","¿Y cómo haces tú entre el tiempo cotidiano
y ese tiempo?",,
01:10:50:21,01:10:55:09,"Through dream, ritual and landscape.","A través del sueño, el ritual y el paisaje.",,
01:10:55:10,01:10:58:12,"That's what makes those time levels
become accessible","Eso es lo que hace que esos niveles de tiempo
se hagan accesibles",,
01:10:58:13,01:11:02:05,"at the current time,
that young people can meet those things.","al tiempo actual,
que los jóvenes puedan conocer esas cosas.",,
01:11:02:06,01:11:07:02,"So to understand the person in the world
Wayuú, to understand the territories,","Entonces, para entender la persona en el mundo
wayuú, para entender los territorios,",,
01:11:07:03,01:11:10:17,"to understand living beings,
everything is explained in time.","para entender los seres vivientes,
todo se explica en el tiempo.",,
01:11:11:25,01:11:15:19,So,Es entonces,,
01:11:15:20,01:11:18:16,"Yes, a Wayuú, he dies like today,","síun wayú, se muere como hoy,",,
01:11:19:15,01:11:22:06,that Wayuú himself is going to convert,ese propio wayú se va a convertir,,
01:11:22:08,01:11:26:08,"on a tree or a hill or whatever, or…","en un árbol o un cerro o lo que sea, o…",,
01:11:27:08,01:11:30:03,"He first takes a trip through the Milky Way,","Él hace un viaje primero por la Vía Láctea,",,
01:11:31:13,01:11:35:08,"a long trip and you arrive at Jepira, another world.","un viaje largo y llegas a Jepira
, mundo otro.",,
01:11:35:23,01:11:39:23,"He will arrive there with his cattle,
the one who was killed at his wake,","Allá va a llegar con su ganado,
el que mataron en su velorio,",,
01:11:40:12,01:11:44:11,"the souls of sacrificed animals
at the wake, goats, cows,","las almas de los animales sacrificados
en el velorio, cabras, vacas,",,
01:11:44:12,01:11:46:09,"sheep, accompany him.","ovejas, lo acompañan.",,
01:11:46:10,01:11:48:14,He needs those cattle to live there,Él necesita ese ganado para vivir allá,,
01:11:49:04,01:11:51:15,and wants to maintain the status he had,y quiere conservar el estatus que tenía,,
01:11:51:16,01:11:54:17,"here, he wants to keep it there.","aquí, lo quiere conservar allá.",,
01:11:54:18,01:11:56:28,"After a while,","Pasado un tiempo,",,
01:11:57:01,01:11:59:03,"his soul begins to dilute,","su alma se empieza a diluir,",,
01:11:59:04,01:12:01:19,begins to lose like life within death,empieza a perder como vida dentro de la muerte,,
01:12:02:12,01:12:04:21,and comes back like rain,y vuelve como lluvia,,
