,Start Time,End Time,EN,ES,Highlight,Comments,Speaker,Interview
1967,00:25:22:22,00:25:26:18,"In what you investigate, in what for the felling","En lo que investigas, en lo que pa la tala",,,arregoces,arregoces
1968,00:25:26:20,00:25:30:04,"to make a house, to build a road.","para hacer casa, para construir camino.",,,arregoces,arregoces
1969,00:25:30:06,00:25:32:12,Every paradise has to be low,Todo paraíso tiene que ser bajo,,,arregoces,arregoces
1970,00:25:32:12,00:25:37:03,"Consult, how the path should be, how it should be done","Consultados, como debe ser el camino, como debe hacer",,,arregoces,arregoces
1971,00:25:37:03,00:25:40:13,"XXX, everything that is going to be done.","XXX, todo lo que se va a hacer.",,,arregoces,arregoces
1972,00:25:40:15,00:25:42:19,That's what we could,Eso es lo que podríamos,,,arregoces,arregoces
1973,00:25:42:19,00:25:45:19,"say, like the government, like","decir, como el gobierno, como",,,arregoces,arregoces
1974,00:25:46:01,00:25:49:19,"a state, that is, or like a government.","un estado, o sea, o como un gobierno.",,,arregoces,arregoces
1975,00:25:49:21,00:25:53:01,"It is what would be called self-government,","Es lo que se le llamaría el gobierno propio,",,,arregoces,arregoces
1976,00:25:53:03,00:25:55:16,"because lately people talk about self-government,","porque últimamente la gente habla de gobierno propio,",,,arregoces,arregoces
1977,00:25:55:16,00:25:59:13,But what is self-government like? self government,"¿Pero, gobierno propio como es? El gobierno propio",,,arregoces,arregoces
1978,00:25:59:13,00:26:03:03,"It is the consultation, in what we do it is what it exercises.","es la consulta, en lo que hacemos es eso que ejerce.",,,arregoces,arregoces
1979,00:26:03:03,00:26:05:05,Then Gonawindúa,Entonces Gonawindúa,,,arregoces,arregoces
1980,00:26:05:05,00:26:08:13,It certainly has a structure and Gonawindúa,Sin duda tiene una estructura y Gonawindúa,,,arregoces,arregoces
1981,00:26:08:15,00:26:12:09,It is represented with the big house that is here.,está representado con la casa grande que está aquí.,,,arregoces,arregoces
1982,00:26:12:11,00:26:15:11,"It has some columns, the big house inside.","Tiene unas columnas, la casa grande adentro.",,,arregoces,arregoces
1983,00:26:15:13,00:26:17:23,"Yes, they are the columns.","Sí, son las columnas.",,,arregoces,arregoces
1984,00:26:17:23,00:26:20:15,"So when we speak we are moved, too","¿Entonces cuando hablamos nos mueven, también",,,arregoces,arregoces
1985,00:26:20:15,00:26:24:02,"Is it the same, everything that the mountain has?","es de la misma, todo lo que tiene la montaña?",,,arregoces,arregoces
1986,00:26:24:04,00:26:26:19,If then,Sí. Entonces,,,arregoces,arregoces
1987,00:26:26:21,00:26:28:21,Gonawindúa is,Gonawindúa es,,,arregoces,arregoces
1988,00:26:28:21,00:26:32:15,"the life of diversity, where it is,","la vida de la diversidad, donde está,",,,arregoces,arregoces
1989,00:26:32:17,00:26:35:17,"where is the life of the earth, the life of the air,","donde está la vida de la tierra, la vida del aire,",,,arregoces,arregoces
1990,00:26:35:23,00:26:38:13,"better said, everyone's life.","mejor dicho, la vida de todos.",,,arregoces,arregoces
1991,00:26:38:13,00:26:40:10,where is life,Donde está la vida,,,arregoces,arregoces
1992,00:26:42:10,00:26:44:14,Where is the lung ?,¿El pulmón donde está?,,,arregoces,arregoces
1993,00:26:44:14,00:26:45:18,Yeah.,Sí.,,,arregoces,arregoces
1994,00:26:45:18,00:26:48:21,So like where is life?,Entonces como donde está la vida,,,arregoces,arregoces
1995,00:26:48:21,00:26:53:03,It is that it achieves that the columns that it descends go down,Es que logra de ello que bajan las columnas que baja,,,arregoces,arregoces
1996,00:26:53:03,00:26:57:14,That is why we fight for ancestral territory,Por eso es que nosotros luchamos el territorio ancestral,,,arregoces,arregoces
1997,00:26:57:16,00:26:59:03,let there be no disasters.,que no haya desastres.,,,arregoces,arregoces
1998,00:26:59:03,00:27:03:08,If one sees that there,Si uno ve que allá,,,arregoces,arregoces
1999,00:27:03:08,00:27:06:08,It's like the XXX we believe,es como el XXX creemos,,,arregoces,arregoces
2000,00:27:06:14,00:27:08:19,here is what we believe,acá es la que creemos,,,arregoces,arregoces
2001,00:27:08:19,00:27:11:21,"XXX no, the XXX says there is the problem.","XXX no, los XXX dice ahí haya es la pata.",,,arregoces,arregoces
2002,00:27:11:21,00:27:15:16,"Here is the peak, it ends here, then all the water","Acá es el pico, termina acá, entonces todo el agua",,,arregoces,arregoces
2003,00:27:15:16,00:27:20:06,",36 rivers in the Sierra Nevada and there are more in the rivers.",",36 ríos en la Sierra Nevada y hay más en los ríos.",,,arregoces,arregoces
2004,00:27:20:08,00:27:23:00,"For this reason, water","Por eso mismo el agua,",,,arregoces,arregoces
2005,00:27:23:00,00:27:27:06,It is a communication of the sea,Es una comunicación del mar,,,arregoces,arregoces
2006,00:27:27:11,00:27:30:23,"to the lagoon above, it has communication,","a laguna arriba, tiene comunicación,",,,arregoces,arregoces
2007,00:27:31:01,00:27:33:16,"has diversity, communication","tiene la diversidad, comunicación",,,arregoces,arregoces
2008,00:27:33:16,00:27:36:16,and that's why you can't cover the water,y por eso es que no se puede tapar el agua,,,arregoces,arregoces
2009,00:27:36:21,00:27:38:14,"and the sacred sites,","y los sitios sagrados,",,,arregoces,arregoces
2010,00:27:38:14,00:27:42:06,So I think Gonawindúa is where life is.,entonces creo Gonawindúa es donde está la vida.,,,arregoces,arregoces
2011,00:27:42:08,00:27:45:13,And Gonawindúa is an organization,Y Gonawindúa es una organización,,,arregoces,arregoces
2012,00:27:45:15,00:27:48:21,"Own, we cannot follow","Propia, que no lo podemos seguir",,,arregoces,arregoces
2013,00:27:48:21,00:27:51:21,"Nor by making various organizations,","Ni haciendo varias organizaciones,",,,arregoces,arregoces
2014,00:27:52:02,00:27:55:16,but that is the organization of the Big House.,sino que esa es la organización de la Casa grande.,,,arregoces,arregoces
2015,00:27:55:18,00:27:59:06,So I think I go down,Entonces creo que bajo,,,arregoces,arregoces
2016,00:27:59:08,00:28:01:03,Gonawindúa,Gonawindúa,,,arregoces,arregoces
2017,00:28:01:03,00:28:06:02,"The thing is that we are here making a documentary, that is, actually directed","Es que estamos aquí haciendo documental, o sea dirigido de hecho",,,arregoces,arregoces
2018,00:28:06:04,00:28:09:09,"That's where a guy told me, that's where someone told me","por ahi un mamo me decía, por ahí alguien me dijo",,,arregoces,arregoces
2019,00:28:09:11,00:28:12:11,that here what is going to speak is Gonawindúa,que aquí lo que va a hablar es Gonawindúa,,,arregoces,arregoces
2020,00:28:12:17,00:28:16:18,"with you, what we are going to film is with Gonawindúa","con ustedes, lo que vamos filmar es con Gonawindúa",,,arregoces,arregoces
2021,00:28:16:20,00:28:19:14,then it is with Gonawindúa,entonces es con Gonawindúa,,,arregoces,arregoces
2022,00:28:19:14,00:28:23:01,"that we are documenting here, then","que aquí estamos documentando, entonces",,,arregoces,arregoces
2023,00:28:23:02,00:28:25:14,I think one day you,creo que algún día a ustedes,,,arregoces,arregoces
2024,00:28:25:14,00:28:26:02,it's going to touch,le va a tocar,,,arregoces,arregoces
2025,00:28:26:02,00:28:29:02,climb Gonawindúa itself to see it up there one day.,subir la propia Gonawindúa a verlo ahí arriba algún día.,,,arregoces,arregoces
2026,00:28:29:08,00:28:31:22,"If this documentary doesn't turn out well,","Si este documental no sale bien,",,,arregoces,arregoces
2027,00:28:31:22,00:28:34:15,We say that it puts its head or its paw.,le ponemos que pone la cabeza o la pata.,,,arregoces,arregoces
2028,00:28:34:15,00:28:38:09,Yes then well I think that's the message.,Si entonces pues creo que ese es el mensaje.,,,arregoces,arregoces
2029,00:28:38:09,00:28:43:03,"That's why in the mountains, everything ends there in Tayrona","Es por eso mismo en la sierra, ahí todo termina en Tayrona",,,arregoces,arregoces
2030,00:28:43:05,00:28:46:04,XXXXX XXXXXXXX XXXXXX,XXXXX XXXXXXX XXXXXX,,,arregoces,arregoces
2031,00:28:46:04,00:28:48:22,and a Tayrona confederation,y una confederación Tayrona,,,arregoces,arregoces
2032,00:28:48:22,00:28:51:21,and the indigenous organization XXX,y la organización indígena XXX,,,arregoces,arregoces
2033,00:28:51:21,00:28:53:21,Because?,¿Por qué?,,,arregoces,arregoces
2034,00:28:53:21,00:28:57:05,"Because they are all mestizo, they lost their language","Porque son todos mestizos, perdieron la lengua",,,arregoces,arregoces
2035,00:28:57:06,00:29:00:06,"They lost habit, losing the hut.","perdieron costumbre, perdiendo la choza.",,,arregoces,arregoces
2036,00:29:00:09,00:29:02:21,"They lost, they lost and they lost.","Perdieron, perdieron y perdieron.",,,arregoces,arregoces
2037,00:29:02:21,00:29:04:20,"They are,","Ellos están,",,,arregoces,arregoces
2038,00:29:04:22,00:29:07:21,I imagine that 50 from now he has to recover.,me imagino que de aquí a 50 tiene que recuperar.,,,arregoces,arregoces
2039,00:29:07:21,00:29:11:04,"If you put batteries in, well, if you don't put batteries in,","Si se ponen pilas pues, si no se ponen pilas,",,,arregoces,arregoces
2040,00:29:11:06,00:29:12:13,they will remain like this.,quedarán así.,,,arregoces,arregoces
2041,00:29:12:13,00:29:14:21,So I think that,Entonces creo que,,,arregoces,arregoces
2042,00:29:14:21,00:29:17:06,that is Gonawindúa and Gonawindúa,esa es Gonawindúa y Gonawindúa,,,arregoces,arregoces
2043,00:29:17:06,00:29:18:23,That's life.,Es la vida.,,,arregoces,arregoces
2044,00:29:18:23,00:29:23:04,"Life, better said, where the life of humanity is,","La vida mejor dicho, donde está la vida de humanidad,",,,arregoces,arregoces
2045,00:29:23:07,00:29:28:21,"humanity, universal life.","la humanidad, la vida universal.",,,arregoces,arregoces
2046,00:29:28:23,00:29:30:11,So,Entonces,,,arregoces,arregoces
2047,00:29:30:11,00:29:34:16,I think that's Gonawindúa.,creo que esa es Gonawindúa.,,,arregoces,arregoces
2048,00:29:39:14,00:29:42:08,"If you can talk if we talk to the mamos a little,","Si usted puede hablar si hablamos con los mamos un poco,",,,arregoces,arregoces
2049,00:29:42:08,00:29:44:13,but let's talk about the life of the breeze.,pero hablemos de la vida de la brisa.,,,arregoces,arregoces
2050,00:29:44:13,00:29:47:18,I know that was something that interested him.,Yo sé que eso fue algo que le interesó.,,,arregoces,arregoces
2051,00:29:50:23,00:29:53:23,"But maybe you also have to listen as it is,","Pero tal vez usted también ha de escuchar como es,",,,arregoces,arregoces
2052,00:29:54:01,00:29:57:10,because before we were also told that well,porque antes también se nos dijo que pues,,,arregoces,arregoces
2053,00:29:57:11,00:30:01:00,"The waters have no border, nor does the breeze there.","las aguas no tienen frontera, tampoco la brisa ahí.",,,arregoces,arregoces
2054,00:30:01:02,00:30:04:08,"So it's a message to the world, right?","¿Así que es un mensaje para el mundo, no?",,,arregoces,arregoces
2055,00:30:04:10,00:30:07:08,"Maybe, then talk a little about","Tal vez, pues hablar un poco de",,,arregoces,arregoces
2056,00:30:07:10,00:30:08:14,How is everything,como está todo,,,arregoces,arregoces
2057,00:30:08:14,00:30:11:16,"connected with this place too, lest this","conectado con este lugar también, no sea que este",,,arregoces,arregoces
2058,00:30:11:16,00:30:14:23,"Place is not only here, in this heart of the world.","Sitio no solo es aquí, en este corazón del mundo.",,,arregoces,arregoces
2059,00:30:14:23,00:30:17:23,But it goes to everyone's door,Pero va hasta la puerta de todos,,,arregoces,arregoces
2060,00:30:18:05,00:30:20:18,who are going to see this documentary.,que van a ver este documental.,,,arregoces,arregoces
2061,00:30:20:18,00:30:26:21,"Let's see, I think","A ver, creo que",,,arregoces,arregoces
2062,00:30:26:23,00:30:31:03,"Without the breeze there would be no life,","sin la brisa no habría vida,",,,arregoces,arregoces
2063,00:30:31:05,00:30:35:13,"So it is that while asleep we breathe,","entonces es que dormidos respiramos,",,,arregoces,arregoces
2064,00:30:35:15,00:30:38:15,"asleep, we breathe, that is,","dormido, respiramos, o sea,",,,arregoces,arregoces
2065,00:30:38:18,00:30:42:01,better said per second.,mejor dicho por segundo.,,,arregoces,arregoces
2066,00:30:42:03,00:30:44:16,How do you save that breeze?,¿Cómo se ahorra esa brisa?,,,arregoces,arregoces
2067,00:30:46:12,00:30:48:15,That too on the way,Eso también en el camino,,,arregoces,arregoces
2068,00:30:48:15,00:30:53:00,"you can go without breathing,","se puede pasar sin respirar,",,,arregoces,arregoces
2069,00:30:53:02,00:30:54:22,"that is, a path","o sea, un camino",,,arregoces,arregoces
2070,00:30:54:22,00:30:58:06,where 100 indigenous people pass today,donde pasa hoy 100 indígenas,,,arregoces,arregoces
2071,00:30:58:08,00:31:01:01,"without breathing from here. 1 2 seconds,","sin respirar de aquí. 1 2 segundos,",,,arregoces,arregoces
2072,00:31:01:01,00:31:05:08,"three seconds, four seconds or four seconds.","tres segundos, cuatro segundos o cuatro segundos.",,,arregoces,arregoces
2073,00:31:05:10,00:31:09:12,"The indigenous person who passes without breathing, saves,","El indígena que sin respirar pasa, ahorra,",,,arregoces,arregoces
2074,00:31:09:14,00:31:12:07,"save,","Ahorra,",,,arregoces,arregoces
2075,00:31:12:07,00:31:14:16,in a different way,en distinto la vía,,,arregoces,arregoces
2076,00:31:14:16,00:31:16:18,"to save it, like sometimes, like outside","para ahorrarla, como a veces, como afuera",,,arregoces,arregoces
2077,00:31:16:18,00:31:20:23,"They say, if the light goes out for a month about 20 minutes.","dicen, si la luz apaga de un mes como unos 20 minutos.",,,arregoces,arregoces
2078,00:31:20:23,00:31:23:10,"Does that save, they say no?","¿Eso se ahorra, dicen no?",,,arregoces,arregoces
2079,00:31:23:10,00:31:25:06,So,Entonces,,,arregoces,arregoces
2080,00:31:25:08,00:31:28:05,I think the breezes,creo que la brisas,,,arregoces,arregoces
2081,00:31:31:13,00:31:34:13,"It is in the physical,","está en el físico,",,,arregoces,arregoces
2082,00:31:34:13,00:31:37:14,It is in gonawindua .,está en gonawindua.,,,arregoces,arregoces
2083,00:31:37:14,00:31:41:01,There is a gap that blows a breeze,Hay un hueco que bota brisa,,,arregoces,arregoces
2084,00:31:45:01,00:31:49:04,and,y,,,arregoces,arregoces
2085,00:31:49:06,00:31:51:06,"we say XXX,","nosotros decimos XXX,",,,arregoces,arregoces
2086,00:31:51:06,00:31:55:18,XXX XXX,XXX XXX,,,arregoces,arregoces
2087,00:31:55:20,00:31:58:13,That is why it is very,Por eso muy es,,,arregoces,arregoces
2088,00:31:58:13,00:32:01:21,partly as,en parte como,,,arregoces,arregoces
2089,00:32:01:23,00:32:05:15,"talking, but you with the breeze, that is,","hablando, pero usted con la brisa, o sea,",,,arregoces,arregoces
2090,00:32:05:17,00:32:09:11,"you are talking but with the breeze,","usted va hablando pero con la brisa,",,,arregoces,arregoces
2091,00:32:09:13,00:32:12:23,"you are talking and you talk with the breeze,","va hablando usted y habla con la brisa,",,,arregoces,arregoces
2092,00:32:13:01,00:32:16:15,but with the breeze he is going to start building.,pero con la brisa ya va a empezar a construir.,,,arregoces,arregoces
2093,00:32:16:17,00:32:19:16,"Hey , let's make a documentary,","Hey, vamos a hacer documental,",,,arregoces,arregoces
2094,00:32:19:19,00:32:23:06,"you start talking to the breeze, that is, and there","usted comienza a hablar con la brisa, o sea, y ahí",,,arregoces,arregoces
2095,00:32:23:06,00:32:26:12,a documentary comes out.,sale un documental.,,,arregoces,arregoces
2096,00:32:26:14,00:32:29:00,So,Entonces,,,arregoces,arregoces
2097,00:32:29:00,00:32:30:22,everything is built,todo está construido,,,arregoces,arregoces
2098,00:32:30:22,00:32:35:15,via XXXX.,a través de XXXX.,,,arregoces,arregoces
2099,00:32:35:17,00:32:38:11,The word.,La palabra.,,,arregoces,arregoces
2100,00:32:38:11,00:32:40:05,"If we are going to make some way,","Si nosotros vamos a hacer alguna vía,",,,arregoces,arregoces
2101,00:32:40:05,00:32:41:18,"we started talking here,","empezamos a hablar aquí,",,,arregoces,arregoces
2102,00:32:41:18,00:32:44:22,"let's go to that road, let's do that, but with the breeze","vamos a esa vía, vamos a hacer eso, pero con la brisa",,,arregoces,arregoces
2103,00:32:44:22,00:32:49:23,"you talk to XXX, with the shovel, with the XXXX","usted habla con XXX, con la pala, con la XXXX",,,arregoces,arregoces
2104,00:32:50:01,00:32:53:01,and with that you build.,y con eso usted construye.,,,arregoces,arregoces
2105,00:32:53:02,00:32:54:17,"Yes, with the same word","Sí, con la misma palabra",,,arregoces,arregoces
2106,00:32:54:17,00:33:00:01,"you build to do harm and you can do it,","usted construye para hace un daño y lo puede hacer,",,,arregoces,arregoces
2107,00:33:00:03,00:33:04:16,"with that same wind it can do damage,","con ese viento mismo puede, hacer el daño,",,,arregoces,arregoces
2108,00:33:04:18,00:33:06:16,and you can send it to do damage,"y lo puede mandar, a hacer el daño",,,arregoces,arregoces
2109,00:33:06:16,00:33:07:14,when that breeze,cuando esa brisa,,,arregoces,arregoces
2110,00:33:07:14,00:33:11:12,"comes, a tremendous breeze that comes","viene, un brisa tremenda que viene",,,arregoces,arregoces
2111,00:33:11:14,00:33:16:05,That breeze is coming. Every person who has done wrong,esa brisa a qué viene. Cada persona que ha obrado mal,,,arregoces,arregoces
2112,00:33:16:06,00:33:21:23,"and that is the same thing that we send it, it does damage to things.","y esa misma es que lo mandamos, hace el daño a las cosas.",,,arregoces,arregoces
2113,00:33:22:01,00:33:27:01,If we speak with a very nice positive,Si hablamos con un positivo muy bonito,,,arregoces,arregoces
2114,00:33:27:03,00:33:31:11,"we make it a good wind,","lo hacemos un viento bueno,",,,arregoces,arregoces
2115,00:33:32:19,00:33:36:07,That's almost what people don't understand.,eso es casi que la gente no comprende,,,arregoces,arregoces
2116,00:33:36:07,00:33:40:00,but only those who can understand who is speaking.,pero solamente quien puede comprender quien habla.,,,arregoces,arregoces
2117,00:33:40:02,00:33:43:01,"That is, you are talking to the breeze,","O sea, usted está hablando con la brisa,",,,arregoces,arregoces
2118,00:33:43:01,00:33:45:22,"that is, you sleep with the breeze.","o sea, duermes con la brisa.",,,arregoces,arregoces
2119,00:33:45:22,00:33:48:20,For this reason it is essential,Por eso mismo es fundamental,,,arregoces,arregoces
2120,00:33:48:20,00:33:50:22,"each society,","cada uno sociedad,",,,arregoces,arregoces
2121,00:33:50:22,00:33:54:18,"what you are going to talk, know how to talk,","lo que usted va a hablar sepa hablar,",,,arregoces,arregoces
2122,00:33:54:20,00:33:57:01,"because the great pollution,","porque la gran contaminación,",,,arregoces,arregoces
2123,00:33:57:01,00:34:00:23,"great earthquake, great damage to","gran terremoto, gran daño a",,,arregoces,arregoces
2124,00:34:01:01,00:34:03:17,"the same human, human spirit","el misma humano, espíritu humano",,,arregoces,arregoces
2125,00:34:03:17,00:34:07:12,"The disaster is making him and he doesn't realize it,","lo está haciendo el desastre y él no se da cuenta,",,,arregoces,arregoces
2126,00:34:07:14,00:34:10:14,He doesn't realize it with the word.,él no se da cuenta con la palabra.,,,arregoces,arregoces
2127,00:34:10:15,00:34:14:07,That is why the breeze almost that we see,Por eso mismo la brisa casi que nosotros vemos,,,arregoces,arregoces
2128,00:34:14:09,00:34:17:09,it comes from the sea.,viene del mar.,,,arregoces,arregoces
2129,00:34:17:11,00:34:17:23,And others,Y otros,,,arregoces,arregoces
2130,00:34:17:23,00:34:22:08,They say that the breeze sometimes comes from the basin rolls.,dicen que la brisa a veces viene de los rollos de la cuenca.,,,arregoces,arregoces
2131,00:34:22:08,00:34:26:08,"They come from the lagoon,","Vienen de la laguna,",,,arregoces,arregoces
2132,00:34:28:11,00:34:31:05,but the breeze is,pero la la brisa está,,,arregoces,arregoces
2133,00:34:31:05,00:34:34:21,"in each one, as a person.","en cada uno, como persona.",,,arregoces,arregoces
2134,00:34:34:23,00:34:37:10,"Look, here I am,","¿Mira, yo aquí estoy,",,,arregoces,arregoces
2135,00:34:37:10,00:34:40:09,"here I am making a contribution with the breeze,","aquí estoy haciendo aporte con la brisa,",,,arregoces,arregoces
2136,00:34:40:13,00:34:44:05,I'm saying it and that,lo estoy diciendo y eso,,,arregoces,arregoces
2137,00:34:44:07,00:34:46:17,"The gentlemen there are listening to me,","los señores de allá me están escuchando,",,,arregoces,arregoces
2138,00:34:46:17,00:34:49:22,"No, this is very nice, you are contributing and they receive it","No, esto está muy bonito, está aportando y lo reciben",,,arregoces,arregoces
2139,00:34:50:00,00:34:50:18,TRUE?,verdad?,,,arregoces,arregoces
2140,00:34:50:18,00:34:55:04,"They arrive and find if they were sunbathing, look for shade,","Llegan y hallan si estaban asoleándose, busquen sombra,",,,arregoces,arregoces
2141,00:34:55:06,00:34:56:18,"Come on, look for the shadow,","vamos, busca la sombra,",,,arregoces,arregoces
2142,00:34:56:18,00:35:00:05,"We're going to sit there, I mean, look for the shade.","Nos vamos a sentar ahí, o sea, busquen la sombra.",,,arregoces,arregoces
2143,00:35:00:05,00:35:02:22,then a person,Entonces una persona,,,arregoces,arregoces
2144,00:35:02:22,00:35:07:08,"It has to continue casting shadows from there,","tiene que seguir haciéndose sombra desde allá,",,,arregoces,arregoces
2145,00:35:07:10,00:35:10:00,Because there is global warming there,Porque allá hay un calentamiento global,,,arregoces,arregoces
2146,00:35:10:00,00:35:11:14,and they need shadows.,y necesitan sombras.,,,arregoces,arregoces
2147,00:35:11:14,00:35:16:06,"Look, here we come and we are looking for the shadow,","Mírelo aquí llegamos y que buscamos la sombra,",,,arregoces,arregoces
2148,00:35:16:08,00:35:17:05,bone the words,ósea las palabras,,,arregoces,arregoces
2149,00:35:17:05,00:35:21:05,"They say XXX, sit where it's cool,","dicen XXX, siéntese donde está fresco,",,,arregoces,arregoces
2150,00:35:21:07,00:35:25:11,look then when they talk about global warming,mira entonces cuando hablan de calentamiento global,,,arregoces,arregoces
2151,00:35:25:11,00:35:29:10,each person,cada persona,,,arregoces,arregoces
2152,00:35:29:10,00:35:32:02,see a shadow,ve una sombra,,,arregoces,arregoces
2153,00:35:32:02,00:35:35:13,so that they live cool.,para que ellos vivan en fresco.,,,arregoces,arregoces
2154,00:35:35:15,00:35:39:04,"But if you are very hot, you are very hot","Pero si usted es de muy caliente, usted muy caliente",,,arregoces,arregoces
2155,00:35:39:05,00:35:41:20,"because there they are dying,","pues allá se van muriendo,",,,arregoces,arregoces
2156,00:35:41:20,00:35:43:17,Like global warming.,Como el calentamiento global.,,,arregoces,arregoces
2157,00:35:43:17,00:35:47:04,"Outside science paints us otherwise,","La ciencia de afuera nos pinta otra cosa,",,,arregoces,arregoces
2158,00:35:47:04,00:35:49:02,"very good, he tells us,","muy bien, nos cuenta,",,,arregoces,arregoces
2159,00:35:49:02,00:35:52:13,But the breeze is,Pero la brisa es,,,arregoces,arregoces
2160,00:35:52:15,00:35:56:11,"breeze, it's asleep,","brisa, es dormido,",,,arregoces,arregoces
2161,00:35:56:13,00:35:59:02,it is working and alive,está funcionando y vivo,,,arregoces,arregoces
2162,00:35:59:02,00:36:01:23,is working.,está funcionando.,,,arregoces,arregoces
2163,00:36:01:23,00:36:04:18,"If you cover yourself here,","Si usted se tapa aquí,",,,arregoces,arregoces
2164,00:36:04:18,00:36:06:20,has nothing to do.,no tiene nada que hacer.,,,arregoces,arregoces
2165,00:36:06:20,00:36:08:13,So,Entonces,,,arregoces,arregoces
2166,00:36:08:13,00:36:10:21,in that same way it is that the hollow that is out there,de esa misma manera es que lo hueco que hay por ahí,,,arregoces,arregoces
2167,00:36:10:21,00:36:14:13,We can't cover it because it has a connection.,no lo podemos tapar porque tiene una conexión,,,arregoces,arregoces
2168,00:36:14:13,00:36:18:04,a breeze is blowing,de esta botando una brisa,,,arregoces,arregoces
2169,00:36:18:06,00:36:22:03,"and another the breeze, what is already a breeze,","y otro la brisa, lo que ya es brisa,",,,arregoces,arregoces
2170,00:36:22:05,00:36:25:04,"the gas that serves us, look at it","el gas que nos sirve, míralo",,,arregoces,arregoces
2171,00:36:25:04,00:36:29:06,"how we throw it away, the example is there","como lo botamos, el ejemplo está ahí",,,arregoces,arregoces
2172,00:36:29:08,00:36:31:07,the gas.,el gas.,,,arregoces,arregoces
2173,00:36:31:07,00:36:35:17,So that's why that gas is,Entonces por eso mismo es ese gas,,,arregoces,arregoces
2174,00:36:35:19,00:36:38:03,"who recycles it,","quien lo recicla,",,,arregoces,arregoces
2175,00:36:38:03,00:36:39:00,recycles it,la recicla,,,arregoces,arregoces
2176,00:36:39:00,00:36:42:19,"Positive words, is what the word","Las palabras positivas, es lo que la palabra",,,arregoces,arregoces
2177,00:36:42:19,00:36:46:16,It rises and becomes a cloud,Sube y se vuelve nube,,,arregoces,arregoces
2178,00:36:46:18,00:36:48:05,Bone becomes cloud.,Ósea se vuelve nube.,,,arregoces,arregoces
2179,00:36:48:05,00:36:53:11,And that's the beautiful thing we talk about in the,Y eso es lo bonito que hablamos en el,,,arregoces,arregoces
2180,00:36:53:16,00:36:58:22,"the gas that is no longer used, you vote on what goes up","el gas que ya no se usa, se vota en lo que sube",,,arregoces,arregoces
2181,00:36:59:03,00:37:05:01,"and recycles it again, and that's how human beings are,","y lo recicla nuevamente, y eso como es el humano,",,,arregoces,arregoces
